NASDAQ:A,A,Agilent Technologies Inc. Common Stock
NASDAQ:AA,AA,Alcoa Corporation Common Stock
NASDAQ:AAC,AAC,Ares Acquisition Corporation Class A Ordinary Shares
NASDAQ:AACG,AACG,ATA Creativity Global American Depositary Shares
NASDAQ:AACIU,AACIU,Armada Acquisition Corp. I Unit
NASDAQ:AADI,AADI,Aadi Bioscience Inc. Common Stock
NASDAQ:AAIC,AAIC,Arlington Asset Investment Corp Class A (new)
NASDAQ:AAIC^C,AAIC^C,Arlington Asset Investment Corp 8.250% Seies C Fixed-to-Floating Rate Cumulative Redeemable Preferred Stock
NASDAQ:AAIN,AAIN,Arlington Asset Investment Corp 6.000% Senior Notes Due 2026
NASDAQ:AAL,AAL,American Airlines Group Inc. Common Stock
NASDAQ:AAMC,AAMC,Altisource Asset Management Corp Com
NASDAQ:AAME,AAME,Atlantic American Corporation Common Stock
NASDAQ:AAN,AAN,Aarons Holdings Company Inc. Common Stock
NASDAQ:AAOI,AAOI,Applied Optoelectronics Inc. Common Stock
NASDAQ:AAON,AAON,AAON Inc. Common Stock
NASDAQ:AAP,AAP,Advance Auto Parts Inc.
NASDAQ:AAPL,AAPL,Apple Inc. Common Stock
NASDAQ:AAQC,AAQC,Accelerate Acquisition Corp. Class A Common Stock
NASDAQ:AAT,AAT,American Assets Trust Inc. Common Stock
NASDAQ:AATC,AATC,Autoscope Technologies Corporation Common Stock
NASDAQ:AAU,AAU,Almaden Minerals Ltd. Common Shares
NASDAQ:AAWW,AAWW,Atlas Air Worldwide Holdings NEW Common Stock
NASDAQ:AB,AB,AllianceBernstein Holding L.P. Units
NASDAQ:ABB,ABB,ABB Ltd Common Stock
NASDAQ:ABBV,ABBV,AbbVie Inc. Common Stock
NASDAQ:ABC,ABC,AmerisourceBergen Corporation Common Stock
NASDAQ:ABCB,ABCB,Ameris Bancorp Common Stock
NASDAQ:ABCL,ABCL,AbCellera Biologics Inc. Common Shares
NASDAQ:ABCM,ABCM,Abcam plc American Depositary Shares
NASDAQ:ABEO,ABEO,Abeona Therapeutics Inc. Common Stock
NASDAQ:ABEV,ABEV,Ambev S.A. American Depositary Shares (Each representing 1 Common Share)
NASDAQ:ABG,ABG,Asbury Automotive Group Inc Common Stock
NASDAQ:ABGI,ABGI,ABG Acquisition Corp. I Class A Ordinary Shares
NASDAQ:ABIO,ABIO,ARCA biopharma Inc. Common Stock
NASDAQ:ABM,ABM,ABM Industries Incorporated Common Stock
NASDAQ:ABMD,ABMD,ABIOMED Inc. Common Stock
NASDAQ:ABNB,ABNB,Airbnb Inc. Class A Common Stock
NASDAQ:ABOS,ABOS,Acumen Pharmaceuticals Inc. Common Stock
NASDAQ:ABR,ABR,Arbor Realty Trust Common Stock
NASDAQ:ABR^D,ABR^D,Arbor Realty Trust 6.375% Series D Cumulative Redeemable Preferred Stock Liquidation Preference $25.00 per Share
NASDAQ:ABR^E,ABR^E,Arbor Realty Trust 6.25% Series E Cumulative Redeemable Preferred Stock
NASDAQ:ABSI,ABSI,Absci Corporation Common Stock
NASDAQ:ABST,ABST,Absolute Software Corporation Common Stock
NASDAQ:ABT,ABT,Abbott Laboratories Common Stock
NASDAQ:ABTX,ABTX,Allegiance Bancshares Inc. Common Stock
NASDAQ:ABUS,ABUS,Arbutus Biopharma Corporation Common Stock
NASDAQ:ABVC,ABVC,ABVC Biopharma Inc. Common Stock
NASDAQ:AC,AC,Associated Capital Group Inc. Common Stock
NASDAQ:ACA,ACA,Arcosa Inc. Common Stock
NASDAQ:ACAD,ACAD,ACADIA Pharmaceuticals Inc. Common Stock
NASDAQ:ACAH,ACAH,Atlantic Coastal Acquisition Corp. Class A Common Stock
NASDAQ:ACAHU,ACAHU,Atlantic Coastal Acquisition Corp. Unit
NASDAQ:ACAHW,ACAHW,Atlantic Coastal Acquisition Corp. Warrant
NASDAQ:ACB,ACB,Aurora Cannabis Inc. Common Shares
NASDAQ:ACBA,ACBA,Ace Global Business Acquisition Limited Ordinary Shares
NASDAQ:ACBAW,ACBAW,Ace Global Business Acquisition Limited Warrant
NASDAQ:ACBI,ACBI,Atlantic Capital Bancshares Inc. Common Stock
NASDAQ:ACC,ACC,American Campus Communities Inc Common Stock
NASDAQ:ACCD,ACCD,Accolade Inc. Common Stock
NASDAQ:ACCO,ACCO,Acco Brands Corporation Common Stock
NASDAQ:ACEL,ACEL,Accel Entertainment Inc.
NASDAQ:ACER,ACER,Acer Therapeutics Inc. Common Stock (DE)
NASDAQ:ACET,ACET,Adicet Bio Inc. Common Stock
NASDAQ:ACEV,ACEV,ACE Convergence Acquisition Corp. Class A Ordinary Shares
NASDAQ:ACEVU,ACEVU,ACE Convergence Acquisition Corp. Unit
NASDAQ:ACEVW,ACEVW,ACE Convergence Acquisition Corp. Warrant
NASDAQ:ACGL,ACGL,Arch Capital Group Ltd. Common Stock
NASDAQ:ACGLN,ACGLN,Arch Capital Group Ltd. Depositary Shares each Representing a 1/1000th Interest in a 4.550% Non-Cumulative Preferred Share Series G
NASDAQ:ACGLO,ACGLO,Arch Capital Group Ltd. Depositary Shares Each Representing 1/1000th Interest in a Share of 5.45% Non-Cumulative Preferred Shares Series F
NASDAQ:ACH,ACH,Aluminum Corporation of China Limited American Depositary Shares
NASDAQ:ACHC,ACHC,Acadia Healthcare Company Inc. Common Stock
NASDAQ:ACHL,ACHL,Achilles Therapeutics plc American Depositary Shares
NASDAQ:ACHR,ACHR,Archer Aviation Inc. Class A Common Stock
NASDAQ:ACHV,ACHV,Achieve Life Sciences Inc. Common Shares
NASDAQ:ACI,ACI,Albertsons Companies Inc. Class A Common Stock
NASDAQ:ACII,ACII,Atlas Crest Investment Corp. II Class A Common Stock
NASDAQ:ACIU,ACIU,AC Immune SA Common Stock
NASDAQ:ACIW,ACIW,ACI Worldwide Inc. Common Stock
NASDAQ:ACKIT,ACKIT,Ackrell SPAC Partners I Co. Subunits
NASDAQ:ACKIW,ACKIW,Ackrell SPAC Partners I Co. Warrants
NASDAQ:ACLS,ACLS,Axcelis Technologies Inc. Common Stock
NASDAQ:ACM,ACM,AECOM Common Stock
NASDAQ:ACMR,ACMR,ACM Research Inc. Class A Common Stock
NASDAQ:ACN,ACN,Accenture plc Class A Ordinary Shares (Ireland)
NASDAQ:ACNB,ACNB,ACNB Corporation Common Stock
NASDAQ:ACOR,ACOR,Acorda Therapeutics Inc. Common Stock
NASDAQ:ACP,ACP,Aberdeen Income Credit Strategies Fund Common Shares
NASDAQ:ACP^A,ACP^A,Aberdeen Income Credit Strategies Fund 5.250% Series A Perpetual Preferred Stock
NASDAQ:ACQR,ACQR,Independence Holdings Corp. Class A Ordinary Share
NASDAQ:ACQRU,ACQRU,Independence Holdings Corp. Units
NASDAQ:ACQRW,ACQRW,Independence Holdings Corp. Warrant
NASDAQ:ACR,ACR,ACRES Commercial Realty Corp. Common Stock
NASDAQ:ACR^C,ACR^C,ACRES Commercial Realty Corp. 8.625% Fixed-to-Floating Series C Cumulative Redeemable Preferred Stock
NASDAQ:ACR^D,ACR^D,ACRES Commercial Realty Corp. 7.875% Series D Cumulative Redeemable Preferred Stock
NASDAQ:ACRE,ACRE,Ares Commercial Real Estate Corporation Common Stock
NASDAQ:ACRO,ACRO,Acropolis Infrastructure Acquisition Corp. Class A Common Stock
NASDAQ:ACRS,ACRS,Aclaris Therapeutics Inc. Common Stock
NASDAQ:ACRX,ACRX,AcelRx Pharmaceuticals Inc. Common Stock
NASDAQ:ACST,ACST,Acasti Pharma Inc. Class A Common Stock
NASDAQ:ACT,ACT,Enact Holdings Inc. Common Stock
NASDAQ:ACTD,ACTD,ArcLight Clean Transition Corp. II Class A Ordinary Share
NASDAQ:ACTDU,ACTDU,ArcLight Clean Transition Corp. II Unit
NASDAQ:ACTG,ACTG,Acacia Research Corporation (Acacia Tech) Common Stock
NASDAQ:ACU,ACU,Acme United Corporation. Common Stock
NASDAQ:ACV,ACV,Virtus AllianzGI Diversified Income & Convertible Fund Common Shares of Beneficial Interest
NASDAQ:ACVA,ACVA,ACV Auctions Inc. Class A Common Stock
NASDAQ:ACXP,ACXP,Acurx Pharmaceuticals Inc. Common Stock
NASDAQ:ACY,ACY,AeroCentury Corp. Common Stock
NASDAQ:ADAG,ADAG,Adagene Inc. American Depositary Shares
NASDAQ:ADAP,ADAP,Adaptimmune Therapeutics plc American Depositary Shares
NASDAQ:ADBE,ADBE,Adobe Inc. Common Stock
NASDAQ:ADC,ADC,Agree Realty Corporation Common Stock
NASDAQ:ADC^A,ADC^A,Agree Realty Corporation Depositary Shares each representing 1/1000th of a 4.250% Series A Cumulative Redeemable Preferred Stock
NASDAQ:ADCT,ADCT,ADC Therapeutics SA Common Shares
NASDAQ:ADER,ADER,26 Capital Acquisition Corp. Class A Common Stock
NASDAQ:ADERU,ADERU,26 Capital Acquisition Corp. Unit
NASDAQ:ADERW,ADERW,26 Capital Acquisition Corp. Warrant
NASDAQ:ADES,ADES,Advanced Emissions Solutions Inc. Common Stock
NASDAQ:ADEX,ADEX,Adit EdTech Acquisition Corp. Common Stock
NASDAQ:ADF,ADF,Aldel Financial Inc. Class A Common Stock
NASDAQ:ADGI,ADGI,Adagio Therapeutics Inc. Common Stock
NASDAQ:ADI,ADI,Analog Devices Inc. Common Stock
NASDAQ:ADIL,ADIL,Adial Pharmaceuticals Inc Common Stock
NASDAQ:ADILW,ADILW,Adial Pharmaceuticals Inc Warrant
NASDAQ:ADM,ADM,Archer-Daniels-Midland Company Common Stock
NASDAQ:ADMA,ADMA,ADMA Biologics Inc Common Stock
NASDAQ:ADMP,ADMP,Adamis Pharmaceuticals Corporation Common Stock
NASDAQ:ADMS,ADMS,Adamas Pharmaceuticals Inc. Common Stock
NASDAQ:ADN,ADN,Advent Technologies Holdings Inc. Class A Common Stock
NASDAQ:ADNT,ADNT,Adient plc Ordinary Shares
NASDAQ:ADNWW,ADNWW,Advent Technologies Holdings Inc. Warrant
NASDAQ:ADOC,ADOC,Edoc Acquisition Corp. Class A Ordinary Share
NASDAQ:ADOCR,ADOCR,Edoc Acquisition Corp. Right
NASDAQ:ADOCW,ADOCW,Edoc Acquisition Corp. Warrant
NASDAQ:ADP,ADP,Automatic Data Processing Inc. Common Stock
NASDAQ:ADPT,ADPT,Adaptive Biotechnologies Corporation Common Stock
NASDAQ:ADRA,ADRA,Adara Acquisition Corp. Class A Common Stock
NASDAQ:ADS,ADS,Alliance Data Systems Corporation Common Stock
NASDAQ:ADSK,ADSK,Autodesk Inc. Common Stock
NASDAQ:ADT,ADT,ADT Inc. Common Stock
NASDAQ:ADTN,ADTN,ADTRAN Inc. Common Stock
NASDAQ:ADTX,ADTX,Aditxt Inc. Common Stock
NASDAQ:ADUS,ADUS,Addus HomeCare Corporation Common Stock
NASDAQ:ADV,ADV,Advantage Solutions Inc. Class A Common Stock
NASDAQ:ADVM,ADVM,Adverum Biotechnologies Inc. Common Stock
NASDAQ:ADVWW,ADVWW,Advantage Solutions Inc. Warrant
NASDAQ:ADX,ADX,Adams Diversified Equity Fund Inc.
NASDAQ:ADXN,ADXN,Addex Therapeutics Ltd American Depositary Shares
NASDAQ:ADXS,ADXS,Advaxis Inc. Common Stock
NASDAQ:AE,AE,Adams Resources & Energy Inc. Common Stock
NASDAQ:AEAC,AEAC,Authentic Equity Acquisition Corp. Class A ordinary share
NASDAQ:AEACU,AEACU,Authentic Equity Acquisition Corp. Unit
NASDAQ:AEACW,AEACW,Authentic Equity Acquisition Corp. Warrant
NASDAQ:AEE,AEE,Ameren Corporation Common Stock
NASDAQ:AEF,AEF,Aberdeen Emerging Markets Equity Income Fund Inc. Common Stock
NASDAQ:AEFC,AEFC,Aegon Funding Company LLC 5.10% Subordinated Notes due 2049
NASDAQ:AEG,AEG,AEGON N.V. Common Stock
NASDAQ:AEHL,AEHL,Antelope Enterprise Holdings Limited Common Stock (0.024 par)
NASDAQ:AEHR,AEHR,Aehr Test Systems Common Stock
NASDAQ:AEI,AEI,Alset EHome International Inc. Common Stock
NASDAQ:AEIS,AEIS,Advanced Energy Industries Inc. Common Stock
NASDAQ:AEL,AEL,American Equity Investment Life Holding Company Common Stock
NASDAQ:AEL^A,AEL^A,American Equity Investment Life Holding Company Depositary Shares each representing a 1/1000th interest in a share of 5.95% Fixed-Rate Reset Non-Cumulative Preferred Stock Series A
NASDAQ:AEL^B,AEL^B,American Equity Investment Life Holding Company Depositary Shares each representing a 1/1000th interest in a share of 6.625% Fixed-Rate Reset Non-Cumulative Preferred Stock Series B
NASDAQ:AEM,AEM,Agnico Eagle Mines Limited Common Stock
NASDAQ:AEMD,AEMD,Aethlon Medical Inc. Common Stock
NASDAQ:AENZ,AENZ,Aenza S.A.A. American Depositary Shares
NASDAQ:AEO,AEO,American Eagle Outfitters Inc. Common Stock
NASDAQ:AEP,AEP,American Electric Power Company Inc. Common Stock
NASDAQ:AEPPL,AEPPL,American Electric Power Company Inc. Corporate Unit
NASDAQ:AEPPZ,AEPPZ,American Electric Power Company Inc. Corporate Units
NASDAQ:AER,AER,AerCap Holdings N.V. Ordinary Shares
NASDAQ:AERI,AERI,Aerie Pharmaceuticals Inc. Common Stock
NASDAQ:AES,AES,The AES Corporation Common Stock
NASDAQ:AESC,AESC,The AES Corporation Corporate Units
NASDAQ:AESE,AESE,Allied Esports Entertainment Inc. Common Stock
NASDAQ:AEVA,AEVA,Aeva Technologies Inc. Common Stock
NASDAQ:AEY,AEY,ADDvantage Technologies Group Inc. Common Stock
NASDAQ:AEYE,AEYE,AudioEye Inc. Common Stock
NASDAQ:AEZS,AEZS,Aeterna Zentaris Inc. Common Stock
NASDAQ:AFAQ,AFAQ,AF Acquisition Corp. Class A Common Stock
NASDAQ:AFAQU,AFAQU,AF Acquisition Corp. Units
NASDAQ:AFAQW,AFAQW,AF Acquisition Corp. Warrants
NASDAQ:AFB,AFB,AllianceBernstein National Municipal Income Fund Inc
NASDAQ:AFBI,AFBI,Affinity Bancshares Inc. Common Stock (MD)
NASDAQ:AFCG,AFCG,AFC Gamma Inc. Common Stock
NASDAQ:AFG,AFG,American Financial Group Inc. Common Stock
NASDAQ:AFGB,AFGB,American Financial Group Inc. 5.875% Subordinated Debentures due 2059
NASDAQ:AFGC,AFGC,American Financial Group Inc. 5.125% Subordinated Debentures due 2059
NASDAQ:AFGD,AFGD,American Financial Group Inc. 5.625% Subordinated Debentures due 2060
NASDAQ:AFGE,AFGE,American Financial Group Inc. 4.500% Subordinated Debentures due 2060
NASDAQ:AFI,AFI,Armstrong Flooring Inc. Common Stock
NASDAQ:AFIB,AFIB,Acutus Medical Inc. Common Stock
NASDAQ:AFIN,AFIN,American Finance Trust Inc. Class A Common Stock
NASDAQ:AFINO,AFINO,American Finance Trust Inc. 7.375% Series C Cumulative Redeemable Preferred Stock
NASDAQ:AFINP,AFINP,American Finance Trust Inc. 7.50% Series A Cumulative Redeemable Perpetual Preferred Stock
NASDAQ:AFL,AFL,AFLAC Incorporated Common Stock
NASDAQ:AFMD,AFMD,Affimed N.V.
NASDAQ:AFRM,AFRM,Affirm Holdings Inc. Class A Common Stock
NASDAQ:AFT,AFT,Apollo Senior Floating Rate Fund Inc. Common Stock
NASDAQ:AFTR,AFTR,AfterNext HealthTech Acquisition Corp. Class A Ordinary Shares
NASDAQ:AFYA,AFYA,Afya Limited Class A Common Shares
NASDAQ:AG,AG,First Majestic Silver Corp. Ordinary Shares (Canada)
NASDAQ:AGAC,AGAC,African Gold Acquisition Corporation Class A Ordinary Shares
NASDAQ:AGBA,AGBA,AGBA Acquisition Limited Ordinary Share
NASDAQ:AGBAR,AGBAR,AGBA Acquisition Limited Right
NASDAQ:AGBAW,AGBAW,AGBA Acquisition Limited Warrant
NASDAQ:AGC,AGC,Altimeter Growth Corp. Class A Ordinary Shares
NASDAQ:AGCB,AGCB,Altimeter Growth Corp. 2 Class A Ordinary Shares
NASDAQ:AGCO,AGCO,AGCO Corporation Common Stock
NASDAQ:AGCUU,AGCUU,Altimeter Growth Corp. Unit
NASDAQ:AGCWW,AGCWW,Altimeter Growth Corp. Warrant
NASDAQ:AGD,AGD,Aberdeen Global Dynamic Dividend Fund
NASDAQ:AGE,AGE,AgeX Therapeutics Inc. Common Stock
NASDAQ:AGEN,AGEN,Agenus Inc. Common Stock
NASDAQ:AGFS,AGFS,AgroFresh Solutions Inc. Common Stock
NASDAQ:AGFY,AGFY,Agrify Corporation Common Stock
NASDAQ:AGGR,AGGR,Agile Growth Corp. Class A Ordinary Share
NASDAQ:AGGRU,AGGRU,Agile Growth Corp. Units
NASDAQ:AGGRW,AGGRW,Agile Growth Corp. Warrant.
NASDAQ:AGI,AGI,Alamos Gold Inc. Class A Common Shares
NASDAQ:AGIL,AGIL,AgileThought Inc. Class A Common Stock
NASDAQ:AGILW,AGILW,AgileThought Inc. Warrant
NASDAQ:AGIO,AGIO,Agios Pharmaceuticals Inc. Common Stock
NASDAQ:AGL,AGL,agilon health inc. Common Stock
NASDAQ:AGLE,AGLE,Aeglea BioTherapeutics Inc. Common Stock
NASDAQ:AGM,AGM,Federal Agricultural Mortgage Corporation Common Stock
NASDAQ:AGM^C,AGM^C,Federal Agricultural Mortgage Corporation Preferred Series C Fixed to Fltg
NASDAQ:AGM^D,AGM^D,Federal Agricultural Mortgage Corporation 5.700% Non-Cumulative Preferred Stock Series D
NASDAQ:AGM^E,AGM^E,Federal Agricultural Mortgage Corporation 5.750% Non-Cumulative Preferred Stock Series E
NASDAQ:AGM^F,AGM^F,Federal Agricultural Mortgage Corporation 5.250% Non-Cumulative Preferred Stock Series F
NASDAQ:AGM^G,AGM^G,Federal Agricultural Mortgage Corporation 4.875% Non-Cumulative Preferred Stock Series G
NASDAQ:AGMH,AGMH,AGM Group Holdings Inc. Class A Ordinary Shares
NASDAQ:AGNC,AGNC,AGNC Investment Corp. Common Stock
NASDAQ:AGNCM,AGNCM,AGNC Investment Corp. Depositary Shares rep 6.875% Series D Fixed-to-Floating Cumulative Redeemable Preferred Stock
NASDAQ:AGNCN,AGNCN,AGNC Investment Corp. Depositary Shares Each Representing a 1/1000th Interest in a Share of 7.00% Series C Fixed-To-Floating Rate Cumulative Redeemable Preferred Stock
NASDAQ:AGNCO,AGNCO,AGNC Investment Corp. Depositary Shares each representing a 1/1000th interest in a share of 6.50% Series E Fixed-to-Floating Cumulative Redeemable Preferred Stock
NASDAQ:AGNCP,AGNCP,AGNC Investment Corp. Depositary Shares Each Representing a 1/1000th Interest in a Share of 6.125% Series F Fixed-to-Floating Rate Cumulative Redeemable Preferred Stock
NASDAQ:AGO,AGO,Assured Guaranty Ltd. Common Stock
NASDAQ:AGR,AGR,Avangrid Inc. Common Stock
NASDAQ:AGRI,AGRI,AgriFORCE Growing Systems Ltd. Common Shares
NASDAQ:AGRIW,AGRIW,AgriFORCE Growing Systems Ltd. Warrant
NASDAQ:AGRO,AGRO,Adecoagro S.A. Common Shares
NASDAQ:AGRX,AGRX,Agile Therapeutics Inc. Common Stock
NASDAQ:AGS,AGS,PlayAGS Inc. Common Stock
NASDAQ:AGTC,AGTC,Applied Genetic Technologies Corporation Common Stock
NASDAQ:AGTI,AGTI,Agiliti Inc. Common Stock
NASDAQ:AGX,AGX,Argan Inc. Common Stock
NASDAQ:AGYS,AGYS,Agilysys Inc. Common Stock
NASDAQ:AHCO,AHCO,AdaptHealth Corp. Common Stock
NASDAQ:AHH,AHH,Armada Hoffler Properties Inc. Common Stock
NASDAQ:AHH^A,AHH^A,Armada Hoffler Properties Inc. 6.75% Series A Cumulative Redeemable Perpetual Preferred Stock
NASDAQ:AHL^C,AHL^C,Aspen Insurance Holdings Limited 5.95% Fixed-to-Floating Rate Perpetual Non-Cumulative Preference Shares
NASDAQ:AHL^D,AHL^D,Aspen Insurance Holdings Limited 5.625% Perpetual Non-Cumulative Preference Shares
NASDAQ:AHL^E,AHL^E,Aspen Insurance Holdings Limited Depositary Shares each representing a 1/1000th interest in a share of 5.625% Perpetual Non-Cumulative Preference Shares
NASDAQ:AHPA,AHPA,Avista Public Acquisition Corp. II Class A Ordinary Shares
NASDAQ:AHPAU,AHPAU,Avista Public Acquisition Corp. II Unit
NASDAQ:AHPI,AHPI,Allied Healthcare Products Inc. Common Stock
NASDAQ:AHT,AHT,Ashford Hospitality Trust Inc Common Stock
NASDAQ:AHT^D,AHT^D,Ashford Hospitality Trust Inc 8.45% Series D Cumulative Preferred Stock
NASDAQ:AHT^F,AHT^F,Ashford Hospitality Trust Inc 7.375% Series F Cumulative Preferred Stock
NASDAQ:AHT^G,AHT^G,Ashford Hospitality Trust Inc 7.375% Series G Cumulative Preferred Stock
NASDAQ:AHT^H,AHT^H,Ashford Hospitality Trust Inc 7.50% Series H Cumulative Preferred Stock
NASDAQ:AHT^I,AHT^I,Ashford Hospitality Trust Inc 7.50% Series I Cumulative Preferred Stock
NASDAQ:AI,AI,C3.ai Inc. Class A Common Stock
NASDAQ:AIC,AIC,Arlington Asset Investment Corp 6.750% Notes due 2025
NASDAQ:AIF,AIF,Apollo Tactical Income Fund Inc. Common Stock
NASDAQ:AIG,AIG,American International Group Inc. New Common Stock
NASDAQ:AIG^A,AIG^A,American International Group Inc. Depositary Shares Each Representing a 1/1000th Interest in a Share of Series A 5.85% Non-Cumulative Perpetual Preferred Stock
NASDAQ:AIH,AIH,Aesthetic Medical International Holdings Group Ltd. American Depositary Shares
NASDAQ:AIHS,AIHS,Senmiao Technology Limited Common Stock
NASDAQ:AIKI,AIKI,AIkido Pharma Inc. Common Stock
NASDAQ:AIM,AIM,AIM ImmunoTech Inc. Common Stock
NASDAQ:AIMC,AIMC,Altra Industrial Motion Corp. Common Stock
NASDAQ:AIN,AIN,Albany International Corporation Common Stock
NASDAQ:AINC,AINC,Ashford Inc. (Holding Company) Common Stock
NASDAQ:AINV,AINV,Apollo Investment Corporation Common Stock
NASDAQ:AIO,AIO,Virtus AllianzGI Artificial Intelligence & Technology Opportunities Fund Common Shares
NASDAQ:AIR,AIR,AAR Corp. Common Stock
NASDAQ:AIRC,AIRC,Apartment Income REIT Corp. Common Stock
NASDAQ:AIRG,AIRG,Airgain Inc. Common Stock
NASDAQ:AIRI,AIRI,Air Industries Group Common Stock
NASDAQ:AIRT,AIRT,Air T Inc. Common Stock
NASDAQ:AIRTP,AIRTP,Air T Inc. Air T Funding Alpha Income Trust Preferred Securities
NASDAQ:AIT,AIT,Applied Industrial Technologies Inc. Common Stock
NASDAQ:AIV,AIV,Apartment Investment and Management Company Common Stock
NASDAQ:AIZ,AIZ,Assurant Inc. Common Stock
NASDAQ:AIZN,AIZN,Assurant Inc. 5.25% Subordinated Notes due 2061
NASDAQ:AJG,AJG,Arthur J. Gallagher & Co. Common Stock
NASDAQ:AJRD,AJRD,Aerojet Rocketdyne Holdings Inc. Common Stock
NASDAQ:AJX,AJX,Great Ajax Corp. Common Stock
NASDAQ:AJXA,AJXA,Great Ajax Corp. 7.25% Convertible Senior Notes due 2024
NASDAQ:AKA,AKA,a.k.a. Brands Holding Corp. Common Stock
NASDAQ:AKAM,AKAM,Akamai Technologies Inc. Common Stock
NASDAQ:AKBA,AKBA,Akebia Therapeutics Inc. Common Stock
NASDAQ:AKICU,AKICU,Sports Ventures Acquisition Corp. Unit
NASDAQ:AKICW,AKICW,Sports Ventures Acquisition Corp. Warrant
NASDAQ:AKO/A,AKO/A,Embotelladora Andina S.A.
NASDAQ:AKO/B,AKO/B,Embotelladora Andina S.A.
NASDAQ:AKR,AKR,Acadia Realty Trust Common Stock
NASDAQ:AKRO,AKRO,Akero Therapeutics Inc. Common Stock
NASDAQ:AKTS,AKTS,Akoustis Technologies Inc. Common Stock
NASDAQ:AKTX,AKTX,Akari Therapeutics plc ADR (0.01 USD)
NASDAQ:AKU,AKU,Akumin Inc. Common Shares
NASDAQ:AKUS,AKUS,Akouos Inc. Common Stock
NASDAQ:AKYA,AKYA,Akoya BioSciences Inc. Common Stock
NASDAQ:AL,AL,Air Lease Corporation Class A Common Stock
NASDAQ:AL^A,AL^A,Air Lease Corporation 6.150% Fixed-to-Floating Rate Non-Cumulative Perpetual Preferred Stock Series A
NASDAQ:ALAC,ALAC,Alberton Acquisition Corporation Ordinary Shares
NASDAQ:ALACR,ALACR,Alberton Acquisition Corporation Rights exp April 26 2021
NASDAQ:ALACW,ALACW,Alberton Acquisition Corporation Warrant
NASDAQ:ALB,ALB,Albemarle Corporation Common Stock
NASDAQ:ALBO,ALBO,Albireo Pharma Inc. Common Stock
NASDAQ:ALC,ALC,Alcon Inc. Ordinary Shares
NASDAQ:ALCC,ALCC,AltC Acquisition Corp. Class A Common Stock
NASDAQ:ALCO,ALCO,Alico Inc. Common Stock
NASDAQ:ALDX,ALDX,Aldeyra Therapeutics Inc. Common Stock
NASDAQ:ALE,ALE,Allete Inc.
NASDAQ:ALEC,ALEC,Alector Inc. Common Stock
NASDAQ:ALEX,ALEX,Alexander & Baldwin Inc. Common Stock REIT Holding Company
NASDAQ:ALF,ALF,ALFI Inc. Common Stock
NASDAQ:ALFIW,ALFIW,ALFI Inc. Warrant
NASDAQ:ALG,ALG,Alamo Group Inc. Common Stock
NASDAQ:ALGM,ALGM,Allegro MicroSystems Inc. Common Stock
NASDAQ:ALGN,ALGN,Align Technology Inc. Common Stock
NASDAQ:ALGS,ALGS,Aligos Therapeutics Inc. Common Stock
NASDAQ:ALGT,ALGT,Allegiant Travel Company Common Stock
NASDAQ:ALHC,ALHC,Alignment Healthcare Inc. Common Stock
NASDAQ:ALIM,ALIM,Alimera Sciences Inc. Common Stock
NASDAQ:ALIN^A,ALIN^A,Altera Infrastructure L.P. 7.25% Series A
NASDAQ:ALIN^B,ALIN^B,Altera Infrastructure L.P. 8.50% Series B
NASDAQ:ALIN^E,ALIN^E,Altera Infrastructure L.P. 8.875% Series E
NASDAQ:ALIT,ALIT,Alight Inc. Class A Common Stock
NASDAQ:ALJJ,ALJJ,ALJ Regional Holdings Inc. Common Stock
NASDAQ:ALK,ALK,Alaska Air Group Inc. Common Stock
NASDAQ:ALKS,ALKS,Alkermes plc Ordinary Shares
NASDAQ:ALKT,ALKT,Alkami Technology Inc. Common Stock
NASDAQ:ALL,ALL,Allstate Corporation (The) Common Stock
NASDAQ:ALL^B,ALL^B,Allstate Corporation (The) 5.100% Fixed-to-Floating Rate Subordinated Debentures due 2053
NASDAQ:ALL^G,ALL^G,Allstate Corporation (The) Depositary Shares each representing a 1/1000th interest in a share of Fixed Rate Noncumulative Perpetual Preferred Stock Series G
NASDAQ:ALL^H,ALL^H,Allstate Corporation (The) Depositary Shares each representing a 1/1000th interest in a share of Fixed Rate Noncumulative Perpetual Preferred Stock Series H
NASDAQ:ALL^I,ALL^I,Allstate Corporation (The) Depositary Shares each representing a 1/1000th interest in a share of Fixed Rate Noncumulative Perpetual Preferred Stock Series I
NASDAQ:ALLE,ALLE,Allegion plc Ordinary Shares
NASDAQ:ALLK,ALLK,Allakos Inc. Common Stock
NASDAQ:ALLO,ALLO,Allogene Therapeutics Inc. Common Stock
NASDAQ:ALLT,ALLT,Allot Ltd. Ordinary Shares
NASDAQ:ALLY,ALLY,Ally Financial Inc. Common Stock
NASDAQ:ALNA,ALNA,Allena Pharmaceuticals Inc. Common Stock
NASDAQ:ALNY,ALNY,Alnylam Pharmaceuticals Inc. Common Stock
NASDAQ:ALOT,ALOT,AstroNova Inc. Common Stock
NASDAQ:ALP^Q,ALP^Q,Alabama Power Company 5.00% Class A Preferred Stock Cumulative Par Value $1 Per Share (Stated Capital $25 Per Share)
NASDAQ:ALPA,ALPA,Alpha Healthcare Acquisition Corp. III Class A Common Stock
NASDAQ:ALPAU,ALPAU,Alpha Healthcare Acquisition Corp. III Units
NASDAQ:ALPAW,ALPAW,Alpha Healthcare Acquisition Corp. III Warrant
NASDAQ:ALPN,ALPN,Alpine Immune Sciences Inc. Common Stock
NASDAQ:ALRM,ALRM,Alarm.com Holdings Inc. Common Stock
NASDAQ:ALRN,ALRN,Aileron Therapeutics Inc. Common Stock
NASDAQ:ALRS,ALRS,Alerus Financial Corporation Common Stock
NASDAQ:ALSN,ALSN,Allison Transmission Holdings Inc. Common Stock
NASDAQ:ALT,ALT,Altimmune Inc. Common Stock
NASDAQ:ALTG,ALTG,Alta Equipment Group Inc. Class A Common Stock
NASDAQ:ALTG^A,ALTG^A,Alta Equipment Group Inc. Depositary Shares (each representing 1/1000th in a share of 10% Series A Cumulative Perpetual Preferred Stock)
NASDAQ:ALTM,ALTM,Altus Midstream Company Class A Common Stock
NASDAQ:ALTO,ALTO,Alto Ingredients Inc. Common Stock
NASDAQ:ALTR,ALTR,Altair Engineering Inc. Class A Common Stock
NASDAQ:ALTU,ALTU,Altitude Acquisition Corp. Class A Common Stock
NASDAQ:ALTUU,ALTUU,Altitude Acquisition Corp. Unit
NASDAQ:ALTUW,ALTUW,Altitude Acquisition Corp. Warrant
NASDAQ:ALV,ALV,Autoliv Inc. Common Stock
NASDAQ:ALVR,ALVR,AlloVir Inc. Common Stock
NASDAQ:ALX,ALX,Alexander's Inc. Common Stock
NASDAQ:ALXO,ALXO,ALX Oncology Holdings Inc. Common Stock
NASDAQ:ALYA,ALYA,Alithya Group inc. Class A Subordinate Voting Shares
NASDAQ:ALZN,ALZN,Alzamend Neuro Inc. Common Stock
NASDAQ:AM,AM,Antero Midstream Corporation Common Stock
NASDAQ:AMAL,AMAL,Amalgamated Financial Corp. Common Stock (DE)
NASDAQ:AMAM,AMAM,Ambrx Biopharma Inc. American Depositary Shares (each representing seven Ordinary Shares)
NASDAQ:AMAO,AMAO,American Acquisition Opportunity Inc. Class A Common Stock
NASDAQ:AMAOW,AMAOW,American Acquisition Opportunity Inc. Warrant
NASDAQ:AMAT,AMAT,Applied Materials Inc. Common Stock
NASDAQ:AMBA,AMBA,Ambarella Inc. Ordinary Shares
NASDAQ:AMBC,AMBC,Ambac Financial Group Inc. Common Stock
NASDAQ:AMBO,AMBO,Ambow Education Holding Ltd. American Depository Shares each representing two Class A ordinary shares
NASDAQ:AMBP,AMBP,Ardagh Metal Packaging S.A. Ordinary Shares
NASDAQ:AMC,AMC,AMC Entertainment Holdings Inc. Class A Common Stock
NASDAQ:AMCI,AMCI,AMCI Acquisition Corp. II Class A Common Stock
NASDAQ:AMCIU,AMCIU,AMCI Acquisition Corp. II Units
NASDAQ:AMCIW,AMCIW,AMCI Acquisition Corp. II Warrant
NASDAQ:AMCR,AMCR,Amcor plc Ordinary Shares
NASDAQ:AMCX,AMCX,AMC Networks Inc. Class A Common Stock
NASDAQ:AMD,AMD,Advanced Micro Devices Inc. Common Stock
NASDAQ:AME,AME,AMETEK Inc.
NASDAQ:AMED,AMED,Amedisys Inc Common Stock
NASDAQ:AMEH,AMEH,Apollo Medical Holdings Inc. Common Stock
NASDAQ:AMG,AMG,Affiliated Managers Group Inc. Common Stock
NASDAQ:AMGN,AMGN,Amgen Inc. Common Stock
NASDAQ:AMH,AMH,American Homes 4 Rent Common Shares of Beneficial Interest
