NASDAQ:EPRT,EPRT,Essential Properties Realty Trust Inc. Common Stock
NASDAQ:EPSN,EPSN,Epsilon Energy Ltd. Common Share
NASDAQ:EPWR,EPWR,Empowerment & Inclusion Capital I Corp. Class A Common Stock
NASDAQ:EPZM,EPZM,Epizyme Inc. Common Stock
NASDAQ:EQ,EQ,Equillium Inc. Common Stock
NASDAQ:EQBK,EQBK,Equity Bancshares Inc. Class A Common Stock
NASDAQ:EQC,EQC,Equity Commonwealth Common Shares of Beneficial Interest
NASDAQ:EQC^D,EQC^D,Equity Commonwealth 6.50% Pfd Conv Shs Ser D
NASDAQ:EQD,EQD,Equity Distribution Acquisition Corp. Class A Common Stock
NASDAQ:EQH,EQH,Equitable Holdings Inc. Common Stock
NASDAQ:EQH^A,EQH^A,Equitable Holdings Inc. Depositary Shares
NASDAQ:EQH^C,EQH^C,Equitable Holdings Inc. Depositary Shares each representing a 1/1000th interest in a share of Fixed Rate Noncumulative Perpetual Preferred Stock Series C
NASDAQ:EQHA,EQHA,EQ Health Acquisition Corp. Class A Common Stock
NASDAQ:EQIX,EQIX,Equinix Inc. Common Stock REIT
NASDAQ:EQNR,EQNR,Equinor ASA
NASDAQ:EQOS,EQOS,Diginex Limited Ordinary Shares
NASDAQ:EQR,EQR,Equity Residential Common Shares of Beneficial Interest
NASDAQ:EQS,EQS,Equus Total Return Inc. Common Stock
NASDAQ:EQT,EQT,EQT Corporation Common Stock
NASDAQ:EQX,EQX,Equinox Gold Corp. Common Shares
NASDAQ:ERAS,ERAS,Erasca Inc. Common Stock
NASDAQ:ERC,ERC,Wells Fargo Multi-Sector Income Fund Common Stock no par value
NASDAQ:ERES,ERES,East Resources Acquisition Company Class A Common Stock
NASDAQ:ERESU,ERESU,East Resources Acquisition Company Unit
NASDAQ:ERESW,ERESW,East Resources Acquisition Company Warrant
NASDAQ:ERF,ERF,Enerplus Corporation Common Stock
NASDAQ:ERH,ERH,Wells Fargo Utilities and High Income Fund
NASDAQ:ERIC,ERIC,Ericsson American Depositary Shares
NASDAQ:ERIE,ERIE,Erie Indemnity Company Class A Common Stock
NASDAQ:ERII,ERII,Energy Recovery Inc. Common Stock
NASDAQ:ERJ,ERJ,Embraer S.A. Common Stock
NASDAQ:ERO,ERO,Ero Copper Corp. Common Shares
NASDAQ:ERYP,ERYP,Erytech Pharma S.A. American Depositary Shares
NASDAQ:ES,ES,Eversource Energy (D/B/A) Common Stock
NASDAQ:ESBK,ESBK,Elmira Savings Bank Elmira NY Common Stock
NASDAQ:ESCA,ESCA,Escalade Incorporated Common Stock
NASDAQ:ESE,ESE,ESCO Technologies Inc. Common Stock
NASDAQ:ESEA,ESEA,Euroseas Ltd. Common Stock (Marshall Islands)
NASDAQ:ESGC,ESGC,Eros STX Global Corporation A Ordinary Shares
NASDAQ:ESGR,ESGR,Enstar Group Limited Ordinary Shares
NASDAQ:ESGRO,ESGRO,Enstar Group Limited Depository Shares 7.00% Perpetual Non-Cumulative Preference Shares Series E
NASDAQ:ESGRP,ESGRP,Enstar Group Limited Depositary Shares Each Representing 1/1000th of an interest in Preference Shares
NASDAQ:ESI,ESI,Element Solutions Inc. Common Stock
NASDAQ:ESLT,ESLT,Elbit Systems Ltd. Ordinary Shares
NASDAQ:ESM,ESM,ESM Acquisition Corporation Class A Ordinary Shares
NASDAQ:ESMT,ESMT,EngageSmart Inc. Common Stock
NASDAQ:ESNT,ESNT,Essent Group Ltd. Common Shares
NASDAQ:ESP,ESP,Espey Mfg. & Electronics Corp. Common Stock
NASDAQ:ESPR,ESPR,Esperion Therapeutics Inc. Common Stock
NASDAQ:ESQ,ESQ,Esquire Financial Holdings Inc. Common Stock
NASDAQ:ESRT,ESRT,Empire State Realty Trust Inc. Class A Common Stock
NASDAQ:ESS,ESS,Essex Property Trust Inc. Common Stock
NASDAQ:ESSA,ESSA,ESSA Bancorp Inc. Common Stock
NASDAQ:ESSC,ESSC,East Stone Acquisition Corporation Ordinary Shares
NASDAQ:ESSCR,ESSCR,East Stone Acquisition Corporation Right
NASDAQ:ESSCU,ESSCU,East Stone Acquisition Corporation Unit
NASDAQ:ESSCW,ESSCW,East Stone Acquisition Corporation Warrant
NASDAQ:ESTA,ESTA,Establishment Labs Holdings Inc. Common Shares
NASDAQ:ESTC,ESTC,Elastic N.V. Ordinary Shares
NASDAQ:ESTE,ESTE,Earthstone Energy Inc. Class A Common Stock
NASDAQ:ESXB,ESXB,Community Bankers Trust Corporation Common Stock (VA)
NASDAQ:ET,ET,Energy Transfer LP Common Units
NASDAQ:ET^C,ET^C,Energy Transfer L.P. 7.375% Series C Fixed-to-Floating Rate Cumulative Redeemable Perpetual Preferred Unit
NASDAQ:ET^D,ET^D,Energy Transfer L.P. 7.625% Series D Fixed-to-Floating Rate Cumulative Redeemable Perpetual Preferred Unit
NASDAQ:ET^E,ET^E,Energy Transfer L.P. 7.600% Series E Fixed-to-Floating Rate Cumulative Redeemable Perpetual Preferred Unit
NASDAQ:ETAC,ETAC,E.Merge Technology Acquisition Corp. Class A Common Stock
NASDAQ:ETACU,ETACU,E.Merge Technology Acquisition Corp. Unit
NASDAQ:ETACW,ETACW,E.Merge Technology Acquisition Corp. Warrant
NASDAQ:ETB,ETB,Eaton Vance Tax-Managed Buy-Write Income Fund Eaton Vance Tax-Managed Buy-Write Income Fund Common Shares of Beneficial Interest
NASDAQ:ETD,ETD,Ethan Allen Interiors Inc. Common Stock
NASDAQ:ETG,ETG,Eaton Vance Tax-Advantaged Global Dividend Income Fund Common Shares of Beneficial Interest
NASDAQ:ETI^,ETI^,Entergy Texas Inc 5.375% Series A Preferred Stock Cumulative No Par Value
NASDAQ:ETJ,ETJ,Eaton Vance Risk-Managed Diversified Equity Income Fund Common Shares of Beneficial Interest
NASDAQ:ETN,ETN,Eaton Corporation PLC Ordinary Shares
NASDAQ:ETNB,ETNB,89bio Inc. Common Stock
NASDAQ:ETO,ETO,Eaton Vance Tax-Advantage Global Dividend Opp Common Stock
NASDAQ:ETON,ETON,Eton Pharmaceuticals Inc. Common Stock
NASDAQ:ETR,ETR,Entergy Corporation Common Stock
NASDAQ:ETRN,ETRN,Equitrans Midstream Corporation Common Stock
NASDAQ:ETSY,ETSY,Etsy Inc. Common Stock
NASDAQ:ETTX,ETTX,Entasis Therapeutics Holdings Inc. Common Stock
NASDAQ:ETV,ETV,Eaton Vance Corporation Eaton Vance Tax-Managed Buy-Write Opportunities Fund Common Shares of Beneficial Interest
NASDAQ:ETW,ETW,Eaton Vance Corporation Eaton Vance Tax-Managed Global Buy-Write Opportunites Fund Common Shares of Beneficial Interest
NASDAQ:ETWO,ETWO,E2open Parent Holdings Inc.Class A Common Stock
NASDAQ:ETX,ETX,Eaton Vance Municipal Income 2028 Term Trust Common Shares of Beneficial Interest
NASDAQ:ETY,ETY,Eaton Vance Tax-Managed Diversified Equity Income Fund Common Shares of Beneficial Interest
NASDAQ:EUCR,EUCR,Eucrates Biomedical Acquisition Corp. Ordinary Shares
NASDAQ:EURN,EURN,Euronav NV Ordinary Shares
NASDAQ:EUSG,EUSG,European Sustainable Growth Acquisition Corp. Class A Ordinary Shares
NASDAQ:EUSGU,EUSGU,European Sustainable Growth Acquisition Corp. Unit
NASDAQ:EUSGW,EUSGW,European Sustainable Growth Acquisition Corp. Warrant
NASDAQ:EVA,EVA,Enviva Partners LP Common units representing limited partner interests
NASDAQ:EVAX,EVAX,Evaxion Biotech A/S American Depositary Share
NASDAQ:EVBG,EVBG,Everbridge Inc. Common Stock
NASDAQ:EVBN,EVBN,Evans Bancorp Inc. Common Stock
NASDAQ:EVC,EVC,Entravision Communications Corporation Common Stock
NASDAQ:EVCM,EVCM,EverCommerce Inc. Common Stock
NASDAQ:EVER,EVER,EverQuote Inc. Class A Common Stock
NASDAQ:EVF,EVF,Eaton Vance Senior Income Trust Common Stock
NASDAQ:EVFM,EVFM,Evofem Biosciences Inc. Common Stock
NASDAQ:EVG,EVG,Eaton Vance Short Diversified Income Fund Eaton Vance Short Duration Diversified Income Fund Common Shares of Beneficial Interest
NASDAQ:EVGN,EVGN,Evogene Ltd Ordinary Shares
NASDAQ:EVGO,EVGO,EVgo Inc. Class A Common Stock
NASDAQ:EVGOW,EVGOW,EVgo Inc. Warrants
NASDAQ:EVH,EVH,Evolent Health Inc Class A Common Stock
NASDAQ:EVI,EVI,EVI Industries Inc. Common Stock
NASDAQ:EVK,EVK,Ever-Glory International Group Inc. Common Stock
NASDAQ:EVLO,EVLO,Evelo Biosciences Inc. Common Stock
NASDAQ:EVLV,EVLV,Evolv Technologies Holdings Inc. Class A Common Stock
NASDAQ:EVLVW,EVLVW,Evolv Technologies Holdings Inc. Warrant
NASDAQ:EVM,EVM,Eaton Vance California Municipal Bond Fund Common Shares of Beneficial Interest $.01 par value
NASDAQ:EVN,EVN,Eaton Vance Municipal Income Trust Common Stock
NASDAQ:EVOJU,EVOJU,Evo Acquisition Corp. Unit
NASDAQ:EVOJW,EVOJW,Evo Acquisition Corp. Warrant
NASDAQ:EVOK,EVOK,Evoke Pharma Inc. Common Stock
NASDAQ:EVOL,EVOL,Evolving Systems Inc. Common Stock
NASDAQ:EVOP,EVOP,EVO Payments Inc. Class A Common Stock
NASDAQ:EVR,EVR,Evercore Inc. Class A Common Stock
NASDAQ:EVRG,EVRG,Evergy Inc. Common Stock
NASDAQ:EVRI,EVRI,Everi Holdings Inc. Common Stock
NASDAQ:EVT,EVT,Eaton Vance Tax Advantaged Dividend Income Fund Common Shares of Beneficial Interest
NASDAQ:EVTC,EVTC,Evertec Inc. Common Stock
NASDAQ:EVV,EVV,Eaton Vance Limited Duration Income Fund Common Shares of Beneficial Interest
NASDAQ:EW,EW,Edwards Lifesciences Corporation Common Stock
NASDAQ:EWBC,EWBC,East West Bancorp Inc. Common Stock
NASDAQ:EWCZ,EWCZ,European Wax Center Inc. Class A Common Stock
NASDAQ:EWTX,EWTX,Edgewise Therapeutics Inc. Common Stock
NASDAQ:EXAI,EXAI,Exscientia Plc American Depositary Shares
NASDAQ:EXAS,EXAS,Exact Sciences Corporation Common Stock
NASDAQ:EXC,EXC,Exelon Corporation Common Stock
NASDAQ:EXD,EXD,Eaton Vance Tax-Managed Buy-Write Strategy Fund Common Shares of Beneficial Interest
NASDAQ:EXEL,EXEL,Exelixis Inc. Common Stock
NASDAQ:EXG,EXG,Eaton Vance Tax-Managed Global Diversified Equity Income Fund Eaton Vance Tax-Managed Global Diversified Equity Income Fund Common Shares of Beneficial Interest
NASDAQ:EXK,EXK,Endeavour Silver Corporation Ordinary Shares (Canada)
NASDAQ:EXLS,EXLS,ExlService Holdings Inc. Common Stock
NASDAQ:EXN,EXN,Excellon Resources Inc. Common Shares
NASDAQ:EXP,EXP,Eagle Materials Inc Common Stock
NASDAQ:EXPD,EXPD,Expeditors International of Washington Inc. Common Stock
NASDAQ:EXPE,EXPE,Expedia Group Inc. Common Stock
NASDAQ:EXPI,EXPI,eXp World Holdings Inc. Common Stock
NASDAQ:EXPO,EXPO,Exponent Inc. Common Stock
NASDAQ:EXPR,EXPR,Express Inc. Common Stock
NASDAQ:EXR,EXR,Extra Space Storage Inc Common Stock
NASDAQ:EXTN,EXTN,Exterran Corporation Common Stock
NASDAQ:EXTR,EXTR,Extreme Networks Inc. Common Stock
NASDAQ:EYE,EYE,National Vision Holdings Inc. Common Stock
NASDAQ:EYEG,EYEG,Eyegate Pharmaceuticals Inc. Common Stock
NASDAQ:EYEN,EYEN,Eyenovia Inc. Common Stock
NASDAQ:EYES,EYES,Second Sight Medical Products Inc. Common Stock
NASDAQ:EYESW,EYESW,Second Sight Medical Products Inc. Warrants expiring 03/14/2024
NASDAQ:EYPT,EYPT,EyePoint Pharmaceuticals Inc. Common Stock
NASDAQ:EZFL,EZFL,EzFill Holdings Inc. Common Stock
NASDAQ:EZGO,EZGO,EZGO Technologies Ltd. Ordinary Shares
NASDAQ:EZPW,EZPW,EZCORP Inc. Class A Non Voting Common Stock
NASDAQ:F,F,Ford Motor Company Common Stock
NASDAQ:F^B,F^B,Ford Motor Company 6.20% Notes due June 1 2059
NASDAQ:F^C,F^C,Ford Motor Company 6% Notes due December 1 2059
NASDAQ:FA,FA,First Advantage Corporation Common Stock
NASDAQ:FACA,FACA,Figure Acquisition Corp. I Class A Common Stock
NASDAQ:FACT,FACT,Freedom Acquisition I Corp. Class A Ordinary Shares
NASDAQ:FAF,FAF,First American Corporation (New) Common Stock
NASDAQ:FAM,FAM,First Trust/Aberdeen Global Opportunity Income Fund First Trust/Aberdeen Global Opportunity Income Fund Common Shares of Beneficial Interest
NASDAQ:FAMI,FAMI,Farmmi Inc. Ordinary Shares
NASDAQ:FANG,FANG,Diamondback Energy Inc. Commmon Stock
NASDAQ:FANH,FANH,Fanhua Inc. American Depositary Shares
NASDAQ:FARM,FARM,Farmer Brothers Company Common Stock
NASDAQ:FARO,FARO,FARO Technologies Inc. Common Stock
NASDAQ:FAST,FAST,Fastenal Company Common Stock
NASDAQ:FAT,FAT,FAT Brands Inc. Class A Common Stock
NASDAQ:FATBB,FATBB,FAT Brands Inc. Class B Common Stock
NASDAQ:FATBP,FATBP,FAT Brands Inc. 8.25% Series B Cumulative Preferred Stock
NASDAQ:FATBW,FATBW,FAT Brands Inc. Warrant
NASDAQ:FATE,FATE,Fate Therapeutics Inc. Common Stock
NASDAQ:FAX,FAX,Aberdeen Asia-Pacific Income Fund Inc Common Stock
NASDAQ:FB,FB,Facebook Inc. Class A Common Stock
NASDAQ:FBC,FBC,Flagstar Bancorp Inc. Common Stock
NASDAQ:FBHS,FBHS,Fortune Brands Home & Security Inc. Common Stock
NASDAQ:FBIO,FBIO,Fortress Biotech Inc. Common Stock
NASDAQ:FBIOP,FBIOP,Fortress Biotech Inc. 9.375% Series A Cumulative Redeemable Perpetual Preferred Stock
NASDAQ:FBIZ,FBIZ,First Business Financial Services Inc. Common Stock
NASDAQ:FBK,FBK,FB Financial Corporation Common Stock
NASDAQ:FBMS,FBMS,First Bancshares Inc.
NASDAQ:FBNC,FBNC,First Bancorp Common Stock
NASDAQ:FBP,FBP,First BanCorp. New Common Stock
NASDAQ:FBRX,FBRX,Forte Biosciences Inc. Common Stock
NASDAQ:FC,FC,Franklin Covey Company Common Stock
NASDAQ:FCAP,FCAP,First Capital Inc. Common Stock
NASDAQ:FCAX,FCAX,Fortress Capital Acquisition Corp. Class A Ordinary Shares
NASDAQ:FCBC,FCBC,First Community Bankshares Inc. (VA) Common Stock
NASDAQ:FCCO,FCCO,First Community Corporation Common Stock
NASDAQ:FCCY,FCCY,1st Constitution Bancorp (NJ) Common Stock
NASDAQ:FCEL,FCEL,FuelCell Energy Inc. Common Stock
NASDAQ:FCF,FCF,First Commonwealth Financial Corporation Common Stock
NASDAQ:FCFS,FCFS,FirstCash Inc. Common Stock
NASDAQ:FCN,FCN,FTI Consulting Inc. Common Stock
NASDAQ:FCNCA,FCNCA,First Citizens BancShares Inc. Class A Common Stock
NASDAQ:FCNCP,FCNCP,First Citizens BancShares Inc. Depositary Shares
NASDAQ:FCO,FCO,Aberdeen Global Income Fund Inc. Common Stock
NASDAQ:FCPT,FCPT,Four Corners Property Trust Inc. Common Stock
NASDAQ:FCRD,FCRD,First Eagle Alternative Capital BDC Inc. Common Stock
NASDAQ:FCRW,FCRW,First Eagle Alternative Capital BDC Inc. 6.125% Notes Due 2023
NASDAQ:FCRX,FCRX,First Eagle Alternative Capital BDC Inc. 5.000% Notes due 2026
NASDAQ:FCT,FCT,First Trust Senior Floating Rate Income Fund II Common Shares of Beneficial Interest
NASDAQ:FCUV,FCUV,Focus Universal Inc. Common Stock
NASDAQ:FCX,FCX,Freeport-McMoRan Inc. Common Stock
NASDAQ:FDBC,FDBC,Fidelity D & D Bancorp Inc. Common Stock
NASDAQ:FDEU,FDEU,First Trust Dynamic Europe Equity Income Fund Common Shares of Beneficial Interest
NASDAQ:FDMT,FDMT,4D Molecular Therapeutics Inc. Common Stock
NASDAQ:FDP,FDP,Fresh Del Monte Produce Inc. Common Stock
NASDAQ:FDS,FDS,FactSet Research Systems Inc. Common Stock
NASDAQ:FDUS,FDUS,Fidus Investment Corporation Common Stock
NASDAQ:FDUSG,FDUSG,Fidus Investment Corporation 5.375% Notes Due 2024
NASDAQ:FDUSZ,FDUSZ,Fidus Investment Corporation 6% Notes due 2024
NASDAQ:FDX,FDX,FedEx Corporation Common Stock
NASDAQ:FE,FE,FirstEnergy Corp. Common Stock
NASDAQ:FEDU,FEDU,Four Seasons Education (Cayman) Inc. American Depositary Shares each two ADSs representing one ordinary share
NASDAQ:FEI,FEI,First Trust MLP and Energy Income Fund Common Shares of Beneficial Interest
NASDAQ:FEIM,FEIM,Frequency Electronics Inc. Common Stock
NASDAQ:FELE,FELE,Franklin Electric Co. Inc. Common Stock
NASDAQ:FEMY,FEMY,Femasys Inc. Common Stock
NASDAQ:FEN,FEN,First Trust Energy Income and Growth Fund
NASDAQ:FENC,FENC,Fennec Pharmaceuticals Inc. Common Stock
NASDAQ:FENG,FENG,Phoenix New Media Limited American Depositary Shares each representing 8 Class A ordinary shares.
NASDAQ:FEO,FEO,First Trust/Aberdeen Emerging Opportunity Fund Common Shares of Beneficial Interest
NASDAQ:FERG,FERG,Ferguson plc Ordinary Shares
NASDAQ:FET,FET,Forum Energy Technologies Inc. Common Stock
NASDAQ:FF,FF,FutureFuel Corp. Common shares
NASDAQ:FFA,FFA,First Trust Enhanced Equity Income Fund
NASDAQ:FFBC,FFBC,First Financial Bancorp. Common Stock
NASDAQ:FFBW,FFBW,FFBW Inc. Common Stock (MD)
NASDAQ:FFC,FFC,Flaherty & Crumrine Preferred and Income Securities Fund Incorporated
NASDAQ:FFHL,FFHL,Fuwei Films (Holdings) Co. Ltd. Ordinary Shares
NASDAQ:FFIC,FFIC,Flushing Financial Corporation Common Stock
NASDAQ:FFIE,FFIE,Faraday Future Intelligent Electric Inc. Common Stock
NASDAQ:FFIEW,FFIEW,Faraday Future Intelligent Electric Inc. Warrant
NASDAQ:FFIN,FFIN,First Financial Bankshares Inc. Common Stock
NASDAQ:FFIV,FFIV,F5 Networks Inc. Common Stock
NASDAQ:FFNW,FFNW,First Financial Northwest Inc. Common Stock
NASDAQ:FFWM,FFWM,First Foundation Inc. Common Stock
NASDAQ:FGB,FGB,First Trust Specialty Finance and Financial Opportunities Fund
NASDAQ:FGBI,FGBI,First Guaranty Bancshares Inc. Common Stock
NASDAQ:FGBIP,FGBIP,First Guaranty Bancshares Inc. 6.75% Series A Fixed-Rate Non-Cumulative Perpetual Preferred Stock
NASDAQ:FGEN,FGEN,FibroGen Inc Common Stock
NASDAQ:FGF,FGF,FG Financial Group Inc. Common Stock
NASDAQ:FGFPP,FGFPP,FG Financial Group Inc. 8.00% Cumulative Preferred Stock
NASDAQ:FHB,FHB,First Hawaiian Inc. Common Stock
NASDAQ:FHI,FHI,Federated Hermes Inc. Common Stock
NASDAQ:FHLTU,FHLTU,Future Health ESG Corp. Unit
NASDAQ:FHN,FHN,First Horizon Corporation Common Stock
NASDAQ:FHN^B,FHN^B,First Horizon Corporation Depositary Shares each representing a 1/400th interest in a share of Non-Cumulative Perpetual Preferred Stock Series B
NASDAQ:FHN^C,FHN^C,First Horizon Corporation Depositary Shares each representing a 1/400th interest in a share of Non-Cumulative Perpetual Preferred Stock Series C
NASDAQ:FHN^D,FHN^D,First Horizon Corporation Depositary Shares each representing a 1/400th interest in a share of Non-Cumulative Perpetual Preferred Stock Series D
NASDAQ:FHN^E,FHN^E,First Horizon Corporation Depositary Shares each representing a 1/4000th interest in a share of Non-Cumulative Perpetual Preferred Stock Series E
NASDAQ:FHN^F,FHN^F,First Horizon Corporation Depositary Shares each representing 1/4000th Interest in a Share of Non-Cumulative Perpetual Preferred Stock Series F
NASDAQ:FHS,FHS,First High-School Education Group Co. Ltd. American Depositary Shares
NASDAQ:FHTX,FHTX,Foghorn Therapeutics Inc. Common Stock
NASDAQ:FIBK,FIBK,First Interstate BancSystem Inc. Class A Common Stock
NASDAQ:FICO,FICO,Fair Isaac Corproation Common Stock
NASDAQ:FICV,FICV,Frontier Investment Corp Class A Ordinary Shares
NASDAQ:FIF,FIF,First Trust Energy Infrastructure Fund Common Shares of Beneficial Interest
NASDAQ:FIGS,FIGS,FIGS Inc. Class A Common Stock
NASDAQ:FINM,FINM,Marlin Technology Corporation Class A Ordinary Share
NASDAQ:FINMU,FINMU,Marlin Technology Corporation Unit
NASDAQ:FINMW,FINMW,Marlin Technology Corporation Warrant
NASDAQ:FINS,FINS,Angel Oak Financial Strategies Income Term Trust Common Shares of Beneficial Interest
NASDAQ:FINV,FINV,FinVolution Group American Depositary Shares
NASDAQ:FIS,FIS,Fidelity National Information Services Inc. Common Stock
NASDAQ:FISI,FISI,Financial Institutions Inc. Common Stock
NASDAQ:FISV,FISV,Fiserv Inc. Common Stock
NASDAQ:FITB,FITB,Fifth Third Bancorp Common Stock
NASDAQ:FITBI,FITBI,Fifth Third Bancorp Depositary Shares
NASDAQ:FITBO,FITBO,Fifth Third Bancorp Depositary Shares each representing a 1/1000th ownership interest in a share of Non-Cumulative Perpetual Preferred Stock Series K
NASDAQ:FITBP,FITBP,Fifth Third Bancorp Depositary Shares each representing 1/40th share of Fifth Third 6.00% Non-Cumulative Perpetual Class B Preferred Stock Series A
NASDAQ:FIV,FIV,First Trust Senior Floating Rate 2022 Target Term Fund Common Shares of Beneficial Interest
NASDAQ:FIVE,FIVE,Five Below Inc. Common Stock
NASDAQ:FIVN,FIVN,Five9 Inc. Common Stock
NASDAQ:FIX,FIX,Comfort Systems USA Inc. Common Stock
NASDAQ:FIXX,FIXX,Homology Medicines Inc. Common Stock
NASDAQ:FIZZ,FIZZ,National Beverage Corp. Common Stock
NASDAQ:FKWL,FKWL,Franklin Wireless Corp. Common Stock
NASDAQ:FL,FL,Foot Locker Inc.
NASDAQ:FLAC,FLAC,Frazier Lifesciences Acquisition Corporation Class A Ordinary Shares
NASDAQ:FLC,FLC,Flaherty & Crumrine Total Return Fund Inc Common Stock
NASDAQ:FLDM,FLDM,Fluidigm Corporation Common Stock
NASDAQ:FLEX,FLEX,Flex Ltd. Ordinary Shares
NASDAQ:FLGC,FLGC,Flora Growth Corp. Common Stock
NASDAQ:FLGT,FLGT,Fulgent Genetics Inc. Common Stock
NASDAQ:FLIC,FLIC,First of Long Island Corporation (The) Common Stock
NASDAQ:FLL,FLL,Full House Resorts Inc. Common Stock
NASDAQ:FLME,FLME,Flame Acquisition Corp. Class A Common Stock
NASDAQ:FLMN,FLMN,Falcon Minerals Corporation Class A Common Stock
NASDAQ:FLMNW,FLMNW,Falcon Minerals Corporation Warrant
NASDAQ:FLNG,FLNG,FLEX LNG Ltd. Ordinary Shares
NASDAQ:FLNT,FLNT,Fluent Inc. Common Stock
NASDAQ:FLO,FLO,Flowers Foods Inc. Common Stock
NASDAQ:FLOW,FLOW,SPX FLOW Inc. Common Stock
NASDAQ:FLR,FLR,Fluor Corporation Common Stock
NASDAQ:FLS,FLS,Flowserve Corporation Common Stock
NASDAQ:FLT,FLT,FleetCor Technologies Inc. Common Stock
NASDAQ:FLUX,FLUX,Flux Power Holdings Inc. Common Stock
NASDAQ:FLWS,FLWS,1-800-FLOWERS.COM Inc. Common Stock
NASDAQ:FLXN,FLXN,Flexion Therapeutics Inc. Common Stock
NASDAQ:FLXS,FLXS,Flexsteel Industries Inc. Common Stock
NASDAQ:FLYW,FLYW,Flywire Corporation Voting Common Stock
NASDAQ:FMAC,FMAC,FirstMark Horizon Acquisition Corp. Class A Common Stock
NASDAQ:FMAO,FMAO,Farmers & Merchants Bancorp Inc. Common Stock
NASDAQ:FMBH,FMBH,First Mid Bancshares Inc. Common Stock
NASDAQ:FMBI,FMBI,First Midwest Bancorp Inc. Common Stock
NASDAQ:FMBIO,FMBIO,First Midwest Bancorp Inc. Depositary Shares Each Representing a 1/40th Interest in a Share of Fixed Rate Non-Cumulative Perpetual Preferred Stock Series C
NASDAQ:FMBIP,FMBIP,First Midwest Bancorp Inc. Depositary Shares Each Representing a 1/40th Interest in a Share of Fixed Rate Non-Cumulative Perpetual Preferred Stock Series A
NASDAQ:FMC,FMC,FMC Corporation Common Stock
NASDAQ:FMIV,FMIV,Forum Merger IV Corporation Class A Common stock
NASDAQ:FMIVU,FMIVU,Forum Merger IV Corporation Unit
NASDAQ:FMN,FMN,Federated Hermes Premier Municipal Income Fund
NASDAQ:FMNB,FMNB,Farmers National Banc Corp. Common Stock
NASDAQ:FMO,FMO,Fiduciary/Claymore Energy Infrastructure Fund Common Shares of Beneficial Interest
NASDAQ:FMS,FMS,Fresenius Medical Care AG Common Stock
NASDAQ:FMTX,FMTX,Forma Therapeutics Holdings Inc. Common Stock
NASDAQ:FMX,FMX,Fomento Economico Mexicano S.A.B. de C.V. Common Stock
NASDAQ:FMY,FMY,First Trust Motgage Income Fund Common Shares of Beneficial Interest
NASDAQ:FN,FN,Fabrinet Ordinary Shares
NASDAQ:FNB,FNB,F.N.B. Corporation Common Stock
NASDAQ:FNB^E,FNB^E,F.N.B. Corporation Depositary Shares each representing a 1/40th interest in a share of Fixed-to-Floating Rate Non-Cumulative Perpetual Preferred Stock Series E
NASDAQ:FNCB,FNCB,FNCB Bancorp Inc. Common Stock
NASDAQ:FNCH,FNCH,Finch Therapeutics Group Inc. Common Stock
NASDAQ:FND,FND,Floor & Decor Holdings Inc. Common Stock
NASDAQ:FNF,FNF,FNF Group of Fidelity National Financial Inc. Common Stock
NASDAQ:FNHC,FNHC,FedNat Holding Company Common Stock
NASDAQ:FNKO,FNKO,Funko Inc. Class A Common Stock
NASDAQ:FNLC,FNLC,First Bancorp Inc (ME) Common Stock
NASDAQ:FNV,FNV,Franco-Nevada Corporation
NASDAQ:FNWB,FNWB,First Northwest Bancorp Common Stock
NASDAQ:FOA,FOA,Finance of America Companies Inc. Class A Common Stock
NASDAQ:FOCS,FOCS,Focus Financial Partners Inc. Class A Common Stock
NASDAQ:FOE,FOE,Ferro Corporation Common Stock
NASDAQ:FOF,FOF,Cohen & Steers Closed-End Opportunity Fund Inc. Common Stock
NASDAQ:FOLD,FOLD,Amicus Therapeutics Inc. Common Stock
NASDAQ:FONR,FONR,Fonar Corporation Common Stock
NASDAQ:FOR,FOR,Forestar Group Inc Common Stock
NASDAQ:FORA,FORA,Forian Inc. Common Stock
NASDAQ:FORD,FORD,Forward Industries Inc. Common Stock
NASDAQ:FORE,FORE,Foresight Acquisition Corp. Class A Common Stock
NASDAQ:FOREU,FOREU,Foresight Acquisition Corp. Units
NASDAQ:FOREW,FOREW,Foresight Acquisition Corp. Warrant
NASDAQ:FORG,FORG,ForgeRock Inc. Class A Common Stock
NASDAQ:FORM,FORM,FormFactor Inc. FormFactor Inc. Common Stock
NASDAQ:FORR,FORR,Forrester Research Inc. Common Stock
NASDAQ:FORTY,FORTY,Formula Systems (1985) Ltd. American Depositary Shares
NASDAQ:FOSL,FOSL,Fossil Group Inc. Common Stock
NASDAQ:FOUR,FOUR,Shift4 Payments Inc. Class A Common Stock
NASDAQ:FOX,FOX,Fox Corporation Class B Common Stock
NASDAQ:FOXA,FOXA,Fox Corporation Class A Common Stock
NASDAQ:FOXF,FOXF,Fox Factory Holding Corp. Common Stock
NASDAQ:FOXW,FOXW,FoxWayne Enterprises Acquisition Corp. Class A Common Stock
NASDAQ:FOXWU,FOXWU,FoxWayne Enterprises Acquisition Corp. Unit
NASDAQ:FOXWW,FOXWW,FoxWayne Enterprises Acquisition Corp. Warrant
NASDAQ:FPAC,FPAC,Far Peak Acquisition Corporation Class A Ordinary Shares
NASDAQ:FPAY,FPAY,FlexShopper Inc. Common Stock
NASDAQ:FPF,FPF,First Trust Intermediate Duration Preferred & Income Fund Common Shares of Beneficial Interest
NASDAQ:FPH,FPH,Five Point Holdings LLC Class A Common Shares
NASDAQ:FPI,FPI,Farmland Partners Inc. Common Stock
NASDAQ:FPL,FPL,First Trust New Opportunities MLP & Energy Fund Common Shares of Beneficial Interest
NASDAQ:FR,FR,First Industrial Realty Trust Inc. Common Stock
NASDAQ:FRA,FRA,Blackrock Floating Rate Income Strategies Fund Inc Common Stock
NASDAQ:FRAF,FRAF,Franklin Financial Services Corporation Common Stock
NASDAQ:FRBA,FRBA,First Bank Common Stock
NASDAQ:FRBK,FRBK,Republic First Bancorp Inc. Common Stock
NASDAQ:FRC,FRC,FIRST REPUBLIC BANK Common Stock
NASDAQ:FRC^H,FRC^H,FIRST REPUBLIC BANK Depositary Shares each representing a 1/40th interest in a share of 5.125% Noncumulative Perpetual Series H Preferred Stock par value $0.01 per share
NASDAQ:FRC^I,FRC^I,FIRST REPUBLIC BANK Depositary Shares each representing a 1/40th interest in a share of 5.50% Noncumulative Perpetual Series I Preferred Stock par value $0.01 per share
NASDAQ:FRC^J,FRC^J,FIRST REPUBLIC BANK Depositary Shares Each Representing a 1/40th Interest in a Share of 4.70% Noncumulative Perpetual Series J Preferred Stock
NASDAQ:FRC^K,FRC^K,FIRST REPUBLIC BANK Depositary Shares Each Representing a 1/40th Interest in a Share of 4.125% Noncumulative Perpetual Series K Preferred Stock
NASDAQ:FRC^L,FRC^L,FIRST REPUBLIC BANK Depositary Shares Each Representing a 1/40th Interest in a Share of 4.250% Noncumulative Perpetual Series L Preferred Stock
NASDAQ:FRC^M,FRC^M,FIRST REPUBLIC BANK Depositary Shares each representing a 1/40th interest in a share of 4.000% Noncumulative Perpetual Series M Preferred Stock
NASDAQ:FRD,FRD,Friedman Industries Inc. Common Stock
NASDAQ:FREE,FREE,Whole Earth Brands Inc. Class A Common Stock
NASDAQ:FREEW,FREEW,Whole Earth Brands Inc. Warrant
NASDAQ:FREQ,FREQ,Frequency Therapeutics Inc. Common Stock
NASDAQ:FREY,FREY,FREYR Battery Ordinary Shares
NASDAQ:FRG,FRG,Franchise Group Inc. Common Stock
NASDAQ:FRGAP,FRGAP,Franchise Group Inc. 7.50% Series A Cumulative Perpetual Preferred Stock
NASDAQ:FRGI,FRGI,Fiesta Restaurant Group Inc. Common Stock
