NASDAQ:SLRC,SLRC,SLR Investment Corp. Common Stock
NASDAQ:SLRX,SLRX,Salarius Pharmaceuticals Inc. Common Stock
NASDAQ:SLS,SLS,SELLAS Life Sciences Group Inc. Common Stock
NASDAQ:SLVM,SLVM,Sylvamo Corporation Common Stock
NASDAQ:SLVRU,SLVRU,SilverSPAC Inc. Unit
NASDAQ:SM,SM,SM Energy Company Common Stock
NASDAQ:SMAR,SMAR,Smartsheet Inc. Class A Common Stock
NASDAQ:SMBC,SMBC,Southern Missouri Bancorp Inc. Common Stock
NASDAQ:SMBK,SMBK,SmartFinancial Inc. Common Stock
NASDAQ:SMCI,SMCI,Super Micro Computer Inc. Common Stock
NASDAQ:SMED,SMED,Sharps Compliance Corp. Common Stock
NASDAQ:SMFG,SMFG,Sumitomo Mitsui Financial Group Inc Unsponsored American Depositary Shares (Japan)
NASDAQ:SMFR,SMFR,Sema4 Holdings Corp. Class A Common Stock
NASDAQ:SMFRW,SMFRW,Sema4 Holdings Corp. Warrant
NASDAQ:SMG,SMG,Scotts Miracle-Gro Company (The) Common Stock
NASDAQ:SMHI,SMHI,SEACOR Marine Holdings Inc. Common Stock
NASDAQ:SMID,SMID,Smith-Midland Corporation Common Stock
NASDAQ:SMIH,SMIH,Summit Healthcare Acquisition Corp. Class A Ordinary Share
NASDAQ:SMIHU,SMIHU,Summit Healthcare Acquisition Corp. Units
NASDAQ:SMIHW,SMIHW,Summit Healthcare Acquisition Corp. Warrant
NASDAQ:SMIT,SMIT,Schmitt Industries Inc. Common Stock
NASDAQ:SMLP,SMLP,Summit Midstream Partners LP Common Units Representing Limited Partner Interests
NASDAQ:SMLR,SMLR,Semler Scientific Inc. Common Stock
NASDAQ:SMM,SMM,Salient Midstream Common Shares of Beneficial Interest
NASDAQ:SMMF,SMMF,Summit Financial Group Inc. Common Stock
NASDAQ:SMMT,SMMT,Summit Therapeutics Inc. Common Stock
NASDAQ:SMP,SMP,Standard Motor Products Inc. Common Stock
NASDAQ:SMPL,SMPL,The Simply Good Foods Company Common Stock
NASDAQ:SMRT,SMRT,SmartRent Inc. Class A Common Stock
NASDAQ:SMSI,SMSI,Smith Micro Software Inc. Common Stock
NASDAQ:SMTC,SMTC,Semtech Corporation Common Stock
NASDAQ:SMTI,SMTI,Sanara MedTech Inc. Common Stock
NASDAQ:SMTS,SMTS,Sierra Metals Inc. Common Stock
NASDAQ:SMWB,SMWB,Similarweb Ltd. Ordinary Shares
NASDAQ:SNA,SNA,Snap-On Incorporated Common Stock
NASDAQ:SNAP,SNAP,Snap Inc. Class A Common Stock
NASDAQ:SNAX,SNAX,Stryve Foods Inc. Class A Common Stock
NASDAQ:SNAXW,SNAXW,Stryve Foods Inc. Warrant
NASDAQ:SNBR,SNBR,Sleep Number Corporation Common Stock
NASDAQ:SNCE,SNCE,Science 37 Holdings Inc. Common Stock
NASDAQ:SNCR,SNCR,Synchronoss Technologies Inc. Common Stock
NASDAQ:SNCRL,SNCRL,Synchronoss Technologies Inc. 8.375% Senior Notes due 2026
NASDAQ:SNCY,SNCY,Sun Country Airlines Holdings Inc. Common Stock
NASDAQ:SND,SND,Smart Sand Inc. Common Stock
NASDAQ:SNDL,SNDL,Sundial Growers Inc. Common Shares
NASDAQ:SNDR,SNDR,Schneider National Inc. Common Stock
NASDAQ:SNDX,SNDX,Syndax Pharmaceuticals Inc. Common Stock
NASDAQ:SNES,SNES,SenesTech Inc. Common Stock
NASDAQ:SNEX,SNEX,StoneX Group Inc. Common Stock
NASDAQ:SNFCA,SNFCA,Security National Financial Corporation Class A Common Stock
NASDAQ:SNGX,SNGX,Soligenix Inc. Common Stock
NASDAQ:SNGXW,SNGXW,Soligenix Inc. Warrant
NASDAQ:SNII,SNII,Supernova Partners Acquisition Company II Ltd. Class A Ordinary Shares
NASDAQ:SNMP,SNMP,Evolve Transition Infrastructure LP Common Stock
NASDAQ:SNN,SNN,Smith & Nephew SNATS Inc. Common Stock
NASDAQ:SNOA,SNOA,Sonoma Pharmaceuticals Inc. Common Stock
NASDAQ:SNOW,SNOW,Snowflake Inc. Class A Common Stock
NASDAQ:SNP,SNP,China Petroleum & Chemical Corporation Common Stock
NASDAQ:SNPO,SNPO,Snap One Holdings Corp. Common Stock
NASDAQ:SNPS,SNPS,Synopsys Inc. Common Stock
NASDAQ:SNPX,SNPX,Synaptogenix Inc. Common Stock
NASDAQ:SNRH,SNRH,Senior Connect Acquisition Corp. I Class A Common Stock
NASDAQ:SNRHU,SNRHU,Senior Connect Acquisition Corp. I Unit
NASDAQ:SNRHW,SNRHW,Senior Connect Acquisition Corp. I Warrant
NASDAQ:SNSE,SNSE,Sensei Biotherapeutics Inc. Common Stock
NASDAQ:SNT,SNT,Senstar Technologies Ltd. Ordinary Shares
NASDAQ:SNTG,SNTG,Sentage Holdings Inc. Ordinary Shares
NASDAQ:SNV,SNV,Synovus Financial Corp. Common Stock
NASDAQ:SNV^D,SNV^D,Synovus Financial Corp. Fixed-to-Floating Rate Non-Cumulative Perpetual Preferred Stock Series D Liquation Preference $25.00 per Share
NASDAQ:SNV^E,SNV^E,Synovus Financial Corp. 5.875% Fixed-Rate Reset Non-Cumulative Perpetual Preferred Stock Series E
NASDAQ:SNX,SNX,Synnex Corporation Common Stock
NASDAQ:SNY,SNY,Sanofi ADR
NASDAQ:SO,SO,Southern Company (The) Common Stock
NASDAQ:SOFI,SOFI,SoFi Technologies Inc. Common Stock
NASDAQ:SOFIW,SOFIW,SoFi Technologies Inc. Warrants
NASDAQ:SOHO,SOHO,Sotherly Hotels Inc. Common Stock
NASDAQ:SOHOB,SOHOB,Sotherly Hotels Inc. 8.0% Series B Cumulative Redeemable Perpetual Preferred Stock
NASDAQ:SOHON,SOHON,Sotherly Hotels Inc. 8.25% Series D Cumulative Redeemable Perpetual Preferred Stock
NASDAQ:SOHOO,SOHOO,Sotherly Hotels Inc. 7.875% Series C Cumulative Redeemable Perpetual Preferred Stock
NASDAQ:SOHU,SOHU,Sohu.com Limited American Depositary Shares
NASDAQ:SOI,SOI,Solaris Oilfield Infrastructure Inc. Class A Common Stock
NASDAQ:SOJC,SOJC,Southern Company (The) Series 2017B 5.25% Junior Subordinated Notes due December 1 2077
NASDAQ:SOJD,SOJD,Southern Company (The) Series 2020A 4.95% Junior Subordinated Notes due January 30 2080
NASDAQ:SOJE,SOJE,Southern Company (The) Series 2020C 4.20% Junior Subordinated Notes due October 15 2060
NASDAQ:SOL,SOL,Renesola Ltd. American Depsitary Shares (Each representing 10 shares)
NASDAQ:SOLN,SOLN,Southern Company (The) 2019 Series A Corporate Units
NASDAQ:SOLO,SOLO,Electrameccanica Vehicles Corp. Ltd. Common Stock
NASDAQ:SOLOW,SOLOW,Electrameccanica Vehicles Corp. Ltd. Warrants
NASDAQ:SOLY,SOLY,Soliton Inc. Common Stock
NASDAQ:SON,SON,Sonoco Products Company Common Stock
NASDAQ:SONM,SONM,Sonim Technologies Inc. Common Stock
NASDAQ:SONN,SONN,Sonnet BioTherapeutics Holdings Inc. Common Stock
NASDAQ:SONO,SONO,Sonos Inc. Common Stock
NASDAQ:SONY,SONY,Sony Group Corporation American Depositary Shares
NASDAQ:SOPH,SOPH,SOPHiA GENETICS SA Ordinary Shares
NASDAQ:SOR,SOR,Source Capital Inc. Common Stock
NASDAQ:SOS,SOS,SOS Limited American Depositary Shares
NASDAQ:SOTK,SOTK,Sono-Tek Corporation Common Stock
NASDAQ:SOVO,SOVO,Sovos Brands Inc. Common Stock
NASDAQ:SP,SP,SP Plus Corporation Common Stock
NASDAQ:SPAQ,SPAQ,Spartan Acquisition Corp. III Class A Common Stock
NASDAQ:SPB,SPB,Spectrum Brands Holdings Inc. Common Stock
NASDAQ:SPCB,SPCB,SuperCom Ltd. Ordinary Shares (Israel)
NASDAQ:SPCE,SPCE,Virgin Galactic Holdings Inc. Common Stock
NASDAQ:SPE,SPE,Special Opportunities Fund Inc Common Stock
NASDAQ:SPFI,SPFI,South Plains Financial Inc. Common Stock
NASDAQ:SPG,SPG,Simon Property Group Inc. Common Stock
NASDAQ:SPG^J,SPG^J,Simon Property Group Inc. Simon Property Group 8 3/8% Series J Cumulative Redeemable Preferred Stock
NASDAQ:SPGI,SPGI,S&P Global Inc. Common Stock
NASDAQ:SPGS,SPGS,Simon Property Group Acquisition Holdings Inc. Class A Common Stock
NASDAQ:SPH,SPH,Suburban Propane Partners L.P. Common Stock
NASDAQ:SPI,SPI,SPI Energy Co. Ltd. Ordinary Shares
NASDAQ:SPIR,SPIR,Spire Global Inc. Class A Common Stock
NASDAQ:SPK,SPK,SPK Acquisition Corp. Common Stock
NASDAQ:SPKAR,SPKAR,SPK Acquisition Corp. Right
NASDAQ:SPKAU,SPKAU,SPK Acquisition Corp Unit
NASDAQ:SPKB,SPKB,Silver Spike Acquisition Corp II Class A Ordinary Shares
NASDAQ:SPKBU,SPKBU,Silver Spike Acquisition Corp II Units
NASDAQ:SPKBW,SPKBW,Silver Spike Acquisition Corp II Warrant
NASDAQ:SPLK,SPLK,Splunk Inc. Common Stock
NASDAQ:SPLP,SPLP,Steel Partners Holdings LP LTD PARTNERSHIP UNIT
NASDAQ:SPLP^A,SPLP^A,Steel Partners Holdings LP 6.0% Series A Preferred Units no par value
NASDAQ:SPNE,SPNE,SeaSpine Holdings Corporation Common Stock
NASDAQ:SPNS,SPNS,Sapiens International Corporation N.V. Common Shares (Cayman Islands)
NASDAQ:SPNT,SPNT,SiriusPoint Ltd. Common Shares
NASDAQ:SPNT^B,SPNT^B,SiriusPoint Ltd. 8.00% Resettable Fixed Rate Preference Shares Series B $25.00 liquidation preference per share
NASDAQ:SPOK,SPOK,Spok Holdings Inc. Common Stock
NASDAQ:SPOT,SPOT,Spotify Technology S.A. Ordinary Shares
NASDAQ:SPPI,SPPI,Spectrum Pharmaceuticals Inc.Common Stock
NASDAQ:SPR,SPR,Spirit Aerosystems Holdings Inc. Common Stock
NASDAQ:SPRB,SPRB,Spruce Biosciences Inc. Common Stock
NASDAQ:SPRO,SPRO,Spero Therapeutics Inc. Common Stock
NASDAQ:SPSC,SPSC,SPS Commerce Inc. Common Stock
NASDAQ:SPT,SPT,Sprout Social Inc Class A Common Stock
NASDAQ:SPTK,SPTK,SportsTek Acquisition Corp. Class A Common Stock
NASDAQ:SPTKU,SPTKU,SportsTek Acquisition Corp. Unit
NASDAQ:SPTKW,SPTKW,SportsTek Acquisition Corp. Warrant
NASDAQ:SPTN,SPTN,SpartanNash Company Common Stock
NASDAQ:SPWH,SPWH,Sportsman's Warehouse Holdings Inc. Common Stock
NASDAQ:SPWR,SPWR,SunPower Corporation Common Stock
NASDAQ:SPXC,SPXC,SPX Corporation Common Stock
NASDAQ:SPXX,SPXX,Nuveen S&P 500 Dynamic Overwrite Fund
NASDAQ:SQ,SQ,Square Inc. Class A Common Stock
NASDAQ:SQFT,SQFT,Presidio Property Trust Inc. Class A Common Stock
NASDAQ:SQFTP,SQFTP,Presidio Property Trust Inc. 9.375% Series D Cumulative Redeemable Perpetual Preferred Stock $0.01 par value per share
NASDAQ:SQL,SQL,SeqLL Inc. Common stock
NASDAQ:SQLLW,SQLLW,SeqLL Inc. Warrant
NASDAQ:SQM,SQM,Sociedad Quimica y Minera S.A. Common Stock
NASDAQ:SQNS,SQNS,Sequans Communications S.A. American Depositary Shares
NASDAQ:SQSP,SQSP,Squarespace Inc. Class A Common Stock
NASDAQ:SQZ,SQZ,SQZ Biotechnologies Company Common Stock
NASDAQ:SR,SR,Spire Inc. Common Stock
NASDAQ:SR^A,SR^A,Spire Inc. Depositary Shares each representing a 1/1000th interest in a share of 5.90% Series A Cumulative Redeemable Perpetual Preferred Stock
NASDAQ:SRAD,SRAD,Sportradar Group AG Class A Ordinary Shares
NASDAQ:SRAX,SRAX,SRAX Inc. Class A Common Stock
NASDAQ:SRC,SRC,Spirit Realty Capital Inc. Common Stock
NASDAQ:SRC^A,SRC^A,Spirit Realty Capital Inc. 6.000% Series A Cumulative Redeemable Preferred Stock
NASDAQ:SRCE,SRCE,1st Source Corporation Common Stock
NASDAQ:SRCL,SRCL,Stericycle Inc. Common Stock
NASDAQ:SRDX,SRDX,Surmodics Inc. Common Stock
NASDAQ:SRE,SRE,DBA Sempra Common Stock
NASDAQ:SREA,SREA,DBA Sempra 5.750% Junior Subordinated Notes due 2079
NASDAQ:SREV,SREV,ServiceSource International Inc. Common Stock
NASDAQ:SRG,SRG,Seritage Growth Properties Class A Common Stock
NASDAQ:SRG^A,SRG^A,Seritage Growth Properties 7.00% Series A Cumulative Redeemable Preferred Shares of Beneficial Interest
NASDAQ:SRGA,SRGA,Surgalign Holdings Inc. Common Stock
NASDAQ:SRI,SRI,Stoneridge Inc. Common Stock
NASDAQ:SRL,SRL,Scully Royalty Ltd.
NASDAQ:SRLP,SRLP,Sprague Resources LP Common Units representing Limited Partner Interests
NASDAQ:SRNE,SRNE,Sorrento Therapeutics Inc. Common Stock
NASDAQ:SRPT,SRPT,Sarepta Therapeutics Inc. Common Stock (DE)
NASDAQ:SRRA,SRRA,Sierra Oncology Inc. Common Stock
NASDAQ:SRRK,SRRK,Scholar Rock Holding Corporation Common Stock
NASDAQ:SRSA,SRSA,Sarissa Capital Acquisition Corp. Class A Ordinary Shares
NASDAQ:SRSAU,SRSAU,Sarissa Capital Acquisition Corp. Unit
NASDAQ:SRT,SRT,StarTek Inc. Common Stock
NASDAQ:SRTS,SRTS,Sensus Healthcare Inc. Common Stock
NASDAQ:SRV,SRV,Cushing MLP & Infrastructure Total Return Fund
NASDAQ:SRZN,SRZN,Surrozen Inc. Common Stock
NASDAQ:SSAA,SSAA,Science Strategic Acquisition Corp. Alpha Class A Common Stock
NASDAQ:SSAAU,SSAAU,Science Strategic Acquisition Corp. Alpha Unit
NASDAQ:SSAAW,SSAAW,Science Strategic Acquisition Corp. Alpha Warrant
NASDAQ:SSB,SSB,SouthState Corporation Common Stock
NASDAQ:SSBI,SSBI,Summit State Bank Common Stock
NASDAQ:SSBK,SSBK,Southern States Bancshares Inc. Common Stock
NASDAQ:SSD,SSD,Simpson Manufacturing Company Inc. Common Stock
NASDAQ:SSKN,SSKN,Strata Skin Sciences Inc. Common Stock
NASDAQ:SSL,SSL,Sasol Ltd. American Depositary Shares
NASDAQ:SSNC,SSNC,SS&C Technologies Holdings Inc. Common Stock
NASDAQ:SSNT,SSNT,SilverSun Technologies Inc. Common Stock
NASDAQ:SSP,SSP,E.W. Scripps Company (The) Class A Common Stock
NASDAQ:SSRM,SSRM,SSR Mining Inc. Common Stock
NASDAQ:SSSS,SSSS,SuRo Capital Corp. Common Stock
NASDAQ:SSTI,SSTI,ShotSpotter Inc. Common Stock
NASDAQ:SSTK,SSTK,Shutterstock Inc. Common Stock
NASDAQ:SSY,SSY,SunLink Health Systems Inc. Common Stock
NASDAQ:SSYS,SSYS,Stratasys Ltd. Ordinary Shares (Israel)
NASDAQ:ST,ST,Sensata Technologies Holding plc Ordinary Shares
NASDAQ:STAA,STAA,STAAR Surgical Company Common Stock
NASDAQ:STAB,STAB,Statera Biopharma Inc. Common Stock
NASDAQ:STAF,STAF,Staffing 360 Solutions Inc. Common Stock (DE)
NASDAQ:STAG,STAG,Stag Industrial Inc. Common Stock
NASDAQ:STAR,STAR,iStar Inc. Common Stock
NASDAQ:STAR^D,STAR^D,iStar Inc. Series D Cumulative Redeemable Preferred Stock
NASDAQ:STAR^G,STAR^G,iStar Inc. Series G Cumulative Redeemable Preferred Stock
NASDAQ:STAR^I,STAR^I,iStar Inc. Series I Cumulative Redeemable Preferred Stock
NASDAQ:STBA,STBA,S&T Bancorp Inc. Common Stock
NASDAQ:STC,STC,Stewart Information Services Corporation Common Stock
NASDAQ:STCN,STCN,Steel Connect Inc. Common Stock
NASDAQ:STE,STE,STERIS plc (Ireland) Ordinary Shares
NASDAQ:STEM,STEM,Stem Inc. Class A Common Stock
NASDAQ:STEP,STEP,StepStone Group Inc. Class A Common Stock
NASDAQ:STER,STER,Sterling Check Corp. Common Stock
NASDAQ:STFC,STFC,State Auto Financial Corporation Common Stock
NASDAQ:STG,STG,Sunlands Technology Group American Depositary Shares representing Class A ordinary shares
NASDAQ:STGW,STGW,Stagwell Inc. Class A Common Stock
NASDAQ:STIM,STIM,Neuronetics Inc. Common Stock
NASDAQ:STK,STK,Columbia Seligman Premium Technology Growth Fund Inc
NASDAQ:STKL,STKL,SunOpta Inc. Common Stock
NASDAQ:STKS,STKS,The ONE Group Hospitality Inc. Common Stock
NASDAQ:STL,STL,Sterling Bancorp
NASDAQ:STL^A,STL^A,Sterling Bancorp Depositary Shares each representing ownership of a 1/40th interest in a share of 6.50% Non-Cumulative Perpetual Preferred Stock Series A
NASDAQ:STLA,STLA,Stellantis N.V. Common Shares
NASDAQ:STLD,STLD,Steel Dynamics Inc.
NASDAQ:STM,STM,STMicroelectronics N.V. Common Stock
NASDAQ:STN,STN,Stantec Inc Common Stock
NASDAQ:STNE,STNE,StoneCo Ltd. Class A Common Shares
NASDAQ:STNG,STNG,Scorpio Tankers Inc. Common Shares
NASDAQ:STOK,STOK,Stoke Therapeutics Inc. Common Stock
NASDAQ:STON,STON,StoneMor Inc. Common Stock
NASDAQ:STOR,STOR,STORE Capital Corporation Common Stock
NASDAQ:STRA,STRA,Strategic Education Inc. Common Stock
NASDAQ:STRC,STRC,Sarcos Technology and Robotics Corporation Common Stock
NASDAQ:STRCW,STRCW,Sarcos Technology and Robotics Corporation Warrants
NASDAQ:STRE,STRE,Supernova Partners Acquisition Company III Ltd. Class A Ordinary Shares
NASDAQ:STRL,STRL,Sterling Construction Company Inc Common Stock
NASDAQ:STRM,STRM,Streamline Health Solutions Inc. Common Stock
NASDAQ:STRO,STRO,Sutro Biopharma Inc. Common Stock
NASDAQ:STRR,STRR,Star Equity Holdings Inc. Common Stock
NASDAQ:STRRP,STRRP,Star Equity Holdings Inc. Series A Cumulative Perpetual Preferred Stock
NASDAQ:STRS,STRS,Stratus Properties Inc. Common Stock
NASDAQ:STRT,STRT,STRATTEC SECURITY CORPORATION Common Stock
NASDAQ:STSA,STSA,Satsuma Pharmaceuticals Inc. Common Stock
NASDAQ:STT,STT,State Street Corporation Common Stock
NASDAQ:STT^D,STT^D,State Street Corporation Depositary Shares representing 1/4000th Perpetual Preferred Series D
NASDAQ:STT^G,STT^G,State Street Corporation Depositary shares each representing a 1/4000th ownership interest in a share of Fixed-to-Floating Rate Non-Cumulative
NASDAQ:STTK,STTK,Shattuck Labs Inc. Common Stock
NASDAQ:STVN,STVN,Stevanato Group S.p.A. Ordinary Shares
NASDAQ:STWD,STWD,STARWOOD PROPERTY TRUST INC. Starwood Property Trust Inc.
NASDAQ:STX,STX,Seagate Technology Holdings PLC Ordinary Shares (Ireland)
NASDAQ:STXB,STXB,Spirit of Texas Bancshares Inc. Common Stock
NASDAQ:STXS,STXS,Stereotaxis Inc. Common Stock
NASDAQ:STZ,STZ,Constellation Brands Inc. Common Stock
NASDAQ:STZ/B,STZ/B,Constellation Brands Inc
NASDAQ:SU,SU,Suncor Energy Inc. Common Stock
NASDAQ:SUI,SUI,Sun Communities Inc. Common Stock
NASDAQ:SUM,SUM,Summit Materials Inc. Class A Common Stock
NASDAQ:SUMO,SUMO,Sumo Logic Inc. Common Stock
NASDAQ:SUMR,SUMR,Summer Infant Inc. Common Stock
NASDAQ:SUN,SUN,Sunoco LP Common Units representing limited partner interests
NASDAQ:SUNL,SUNL,Sunlight Financial Holdings Inc. Class A Common Stock
NASDAQ:SUNS,SUNS,SLR Senior Investment Corp. Common Stock
NASDAQ:SUNW,SUNW,Sunworks Inc. Common Stock
NASDAQ:SUP,SUP,Superior Industries International Inc. Common Stock (DE)
NASDAQ:SUPN,SUPN,Supernus Pharmaceuticals Inc. Common Stock
NASDAQ:SUPV,SUPV,Grupo Supervielle S.A. American Depositary Shares each Representing five Class B shares
NASDAQ:SURF,SURF,Surface Oncology Inc. Common Stock
NASDAQ:SUZ,SUZ,Suzano S.A. American Depositary Shares (each representing One Ordinary Share)
NASDAQ:SV,SV,Spring Valley Acquisition Corp. Class A Ordinary Share
NASDAQ:SVBI,SVBI,Severn Bancorp Inc
NASDAQ:SVC,SVC,Service Properties Trust Common Stock
NASDAQ:SVFA,SVFA,SVF Investment Corp. Class A Ordinary Shares
NASDAQ:SVFAU,SVFAU,SVF Investment Corp. Unit
NASDAQ:SVFAW,SVFAW,SVF Investment Corp. Warrant
NASDAQ:SVFB,SVFB,SVF Investment Corp. 2 Class A Ordinary Shares
NASDAQ:SVFC,SVFC,SVF Investment Corp. 3 Class A Ordinary Shares
NASDAQ:SVFD,SVFD,Save Foods Inc. Common Stock
NASDAQ:SVM,SVM,Silvercorp Metals Inc. Common Shares
NASDAQ:SVOK,SVOK,Seven Oaks Acquisition Corp. Class A Common Stock
NASDAQ:SVOKU,SVOKU,Seven Oaks Acquisition Corp. Unit
NASDAQ:SVOKW,SVOKW,Seven Oaks Acquisition Corp. Warrant
NASDAQ:SVRA,SVRA,Savara Inc. Common Stock
NASDAQ:SVSVU,SVSVU,Spring Valley Acquisition Corp. Unit
NASDAQ:SVSVW,SVSVW,Spring Valley Acquisition Corp. Warrant
NASDAQ:SVT,SVT,Servotronics Inc. Common Stock
NASDAQ:SVVC,SVVC,Firsthand Technology Value Fund Inc. Common Stock
NASDAQ:SWAG,SWAG,Software Acquisition Group Inc. III Class A Common Stock
NASDAQ:SWAGU,SWAGU,Software Acquisition Group Inc. III Unit
NASDAQ:SWAGW,SWAGW,Software Acquisition Group Inc. III Warrant
NASDAQ:SWAV,SWAV,ShockWave Medical Inc. Common Stock
NASDAQ:SWBI,SWBI,Smith & Wesson Brands Inc. Common Stock
NASDAQ:SWBK,SWBK,Switchback II Corporation Class A Ordinary Shares
NASDAQ:SWCH,SWCH,Switch Inc. Class A Common Stock
NASDAQ:SWET,SWET,Athlon Acquisition Corp. Class A Common stock
NASDAQ:SWETU,SWETU,Athlon Acquisition Corp. Unit
NASDAQ:SWETW,SWETW,Athlon Acquisition Corp. Warrant
NASDAQ:SWI,SWI,SolarWinds Corporation Common Stock
NASDAQ:SWIM,SWIM,Latham Group Inc. Common Stock
NASDAQ:SWIR,SWIR,Sierra Wireless Inc. Common Stock
NASDAQ:SWK,SWK,Stanley Black & Decker Inc. Common Stock
NASDAQ:SWKH,SWKH,SWK Holdings Corporation Common Stock
NASDAQ:SWKS,SWKS,Skyworks Solutions Inc. Common Stock
NASDAQ:SWM,SWM,Schweitzer-Mauduit International Inc. Common Stock
NASDAQ:SWN,SWN,Southwestern Energy Company Common Stock
NASDAQ:SWSS,SWSS,Springwater Special Situations Corp. Common stock
NASDAQ:SWSSU,SWSSU,Springwater Special Situations Corp. Unit
NASDAQ:SWSSW,SWSSW,Springwater Special Situations Corp. Warrant
NASDAQ:SWT,SWT,Stanley Black & Decker Inc. Corporate Unit
NASDAQ:SWTX,SWTX,SpringWorks Therapeutics Inc. Common Stock
NASDAQ:SWX,SWX,Southwest Gas Holdings Inc. Common Stock (DE)
NASDAQ:SWZ,SWZ,Swiss Helvetia Fund Inc. (The) Common Stock
NASDAQ:SXC,SXC,SunCoke Energy Inc. Common Stock
NASDAQ:SXI,SXI,Standex International Corporation Common Stock
NASDAQ:SXT,SXT,Sensient Technologies Corporation Common Stock
NASDAQ:SXTC,SXTC,China SXT Pharmaceuticals Inc. Ordinary Shares
NASDAQ:SY,SY,So-Young International Inc. American Depository Shares
NASDAQ:SYBT,SYBT,Stock Yards Bancorp Inc. Common Stock
NASDAQ:SYBX,SYBX,Synlogic Inc. Common Stock
NASDAQ:SYF,SYF,Synchrony Financial Common Stock
NASDAQ:SYF^A,SYF^A,Synchrony Financial Depositary Shares each Representing a 1/40th Interest in a Share of 5.625% Fixed Rate Non-Cumulative Perpetual Preferred Stock Series A
NASDAQ:SYK,SYK,Stryker Corporation Common Stock
NASDAQ:SYN,SYN,Synthetic Biologics Inc. Common Stock
NASDAQ:SYNA,SYNA,Synaptics Incorporated Common Stock $0.001 Par Value
NASDAQ:SYNH,SYNH,Syneos Health Inc. Class A Common Stock
NASDAQ:SYNL,SYNL,Synalloy Corporation Common Stock
NASDAQ:SYPR,SYPR,Sypris Solutions Inc. Common Stock
NASDAQ:SYRS,SYRS,Syros Pharmaceuticals Inc. Common Stock
NASDAQ:SYTA,SYTA,Siyata Mobile Inc. Common Shares
NASDAQ:SYTAW,SYTAW,Siyata Mobile Inc. Warrant
NASDAQ:SYY,SYY,Sysco Corporation Common Stock
NASDAQ:SZC,SZC,Cushing NextGen Infrastructure Income Fund Common Shares of Beneficial Interest
NASDAQ:T,T,AT&T Inc.
NASDAQ:T^A,T^A,AT&T Inc. Depositary Shares each representing a 1/1000th interest in a share of 5.000% Perpetual Preferred Stock Series A
NASDAQ:T^C,T^C,AT&T Inc. Depositary Shares each representing a 1/1000th interest in a share of 4.750% Perpetual Preferred Stock Series C
NASDAQ:TA,TA,TravelCenters of America Inc. Common Stock
NASDAQ:TAC,TAC,TransAlta Corporation Ordinary Shares
NASDAQ:TACA,TACA,Trepont Acquisition Corp I Class A Ordinary Shares
NASDAQ:TACO,TACO,Del Taco Restaurants Inc. Common Stock
NASDAQ:TACT,TACT,TransAct Technologies Incorporated Common Stock
NASDAQ:TAIT,TAIT,Taitron Components Incorporated Class A Common Stock
NASDAQ:TAK,TAK,Takeda Pharmaceutical Company Limited American Depositary Shares (each representing 1/2 of a share of Common Stock)
NASDAQ:TAL,TAL,TAL Education Group American Depositary Shares
NASDAQ:TALK,TALK,Talkspace Inc. Common Stock
NASDAQ:TALKW,TALKW,Talkspace Inc. Warrant
NASDAQ:TALO,TALO,Talos Energy Inc. Common Stock
NASDAQ:TALS,TALS,Talaris Therapeutics Inc. Common Stock
NASDAQ:TANH,TANH,Tantech Holdings Ltd. Common Stock
NASDAQ:TANNI,TANNI,TravelCenters of America Inc. 8.25% Senior Notes due 2028
NASDAQ:TANNL,TANNL,TravelCenters of America Inc. 8.00% Senior Notes due 2029
NASDAQ:TANNZ,TANNZ,TravelCenters of America Inc. 8.00% Senior Notes due 2030
NASDAQ:TAOP,TAOP,Taoping Inc. Ordinary Shares
NASDAQ:TAP,TAP,Molson Coors Beverage Company Class B Common Stock
NASDAQ:TARA,TARA,Protara Therapeutics Inc. Common Stock
NASDAQ:TARO,TARO,Taro Pharmaceutical Industries Ltd. Ordinary Shares
NASDAQ:TARS,TARS,Tarsus Pharmaceuticals Inc. Common Stock
NASDAQ:TASK,TASK,TaskUs Inc. Class A Common Stock
NASDAQ:TAST,TAST,Carrols Restaurant Group Inc. Common Stock
NASDAQ:TATT,TATT,TAT Technologies Ltd. Ordinary Shares
NASDAQ:TAYD,TAYD,Taylor Devices Inc. Common Stock
NASDAQ:TBB,TBB,AT&T Inc. 5.350% Global Notes due 2066
NASDAQ:TBBK,TBBK,The Bancorp Inc Common Stock
NASDAQ:TBC,TBC,AT&T Inc. 5.625% Global Notes due 2067
NASDAQ:TBCP,TBCP,Thunder Bridge Capital Partners III Inc. Class A Common Stock
NASDAQ:TBCPU,TBCPU,Thunder Bridge Capital Partners III Inc. Units
NASDAQ:TBCPW,TBCPW,Thunder Bridge Capital Partners III Inc. Warrant
NASDAQ:TBI,TBI,TrueBlue Inc. Common Stock
NASDAQ:TBK,TBK,Triumph Bancorp Inc. Common Stock
NASDAQ:TBKCP,TBKCP,Triumph Bancorp Inc. Depositary Shares Each Representing a 1/40th Interest in a Share of 7.125% Series C Fixed-Rate Non-Cumulative Perpetual Preferred Stock
NASDAQ:TBLA,TBLA,Taboola.com Ltd. Ordinary Shares
NASDAQ:TBLAW,TBLAW,Taboola.com Ltd. Warrant
NASDAQ:TBLD,TBLD,Thornburg Income Builder Opportunities Trust Common Stock
NASDAQ:TBLT,TBLT,ToughBuilt Industries Inc. Common Stock
NASDAQ:TBLTW,TBLTW,ToughBuilt Industries Inc. Warrant
NASDAQ:TBNK,TBNK,Territorial Bancorp Inc. Common Stock
NASDAQ:TBPH,TBPH,Theravance Biopharma Inc. Ordinary Shares
NASDAQ:TBSA,TBSA,TB SA Acquisition Corp Class A Ordinary Share
NASDAQ:TBSAU,TBSAU,TB SA Acquisition Corp Unit
NASDAQ:TC,TC,TuanChe Limited American Depositary Shares
NASDAQ:TCAC,TCAC,Tuatara Capital Acquisition Corporation Class A Ordinary Shares
NASDAQ:TCACU,TCACU,Tuatara Capital Acquisition Corporation Unit
NASDAQ:TCACW,TCACW,Tuatara Capital Acquisition Corporation Warrant
NASDAQ:TCBC,TCBC,TC Bancshares Inc. Common Stock
NASDAQ:TCBI,TCBI,Texas Capital Bancshares Inc. Common Stock
NASDAQ:TCBIO,TCBIO,Texas Capital Bancshares Inc. Depositary Shares 5.75% Fixed Rate Non-Cumulative Perpetual Preferred Stock Series B
NASDAQ:TCBK,TCBK,TriCo Bancshares Common Stock
NASDAQ:TCBS,TCBS,Texas Community Bancshares Inc. Common Stock
NASDAQ:TCDA,TCDA,Tricida Inc. Common Stock
NASDAQ:TCFC,TCFC,The Community Financial Corporation Common Stock
NASDAQ:TCI,TCI,Transcontinental Realty Investors Inc. Common Stock
NASDAQ:TCMD,TCMD,Tactile Systems Technology Inc. Common Stock
NASDAQ:TCN,TCN,Tricon Residential Inc. Common Shares
NASDAQ:TCOM,TCOM,Trip.com Group Limited American Depositary Shares
NASDAQ:TCON,TCON,TRACON Pharmaceuticals Inc. Common Stock
NASDAQ:TCPC,TCPC,BlackRock TCP Capital Corp. Common Stock
NASDAQ:TCRR,TCRR,TCR2 Therapeutics Inc. Common Stock
NASDAQ:TCRX,TCRX,TScan Therapeutics Inc. Common Stock
NASDAQ:TCS,TCS,Container Store (The) Common Stock
NASDAQ:TCVA,TCVA,TCV Acquisition Corp. Class A Ordinary Shares
NASDAQ:TCX,TCX,Tucows Inc. Class A Common Stock
NASDAQ:TD,TD,Toronto Dominion Bank (The) Common Stock
NASDAQ:TDAC,TDAC,Trident Acquisitions Corp. Common Stock
NASDAQ:TDACU,TDACU,Trident Acquisitions Corp. Units
NASDAQ:TDACW,TDACW,Trident Acquisitions Corp. Warrants
NASDAQ:TDC,TDC,Teradata Corporation Common Stock
NASDAQ:TDCX,TDCX,TDCX Inc. American Depositary Shares each representing one Class A ordinary share
NASDAQ:TDF,TDF,Templeton Dragon Fund Inc. Common Stock
NASDAQ:TDG,TDG,Transdigm Group Incorporated Common Stock
NASDAQ:TDOC,TDOC,Teladoc Health Inc. Common Stock
NASDAQ:TDS,TDS,Telephone and Data Systems Inc. Common Shares
NASDAQ:TDS^U,TDS^U,Telephone and Data Systems Inc. Depositary Shares Each Representing a 1/1000th Interest in a 6.625% Series UU Cumulative Redeemable Perpetual Preferred Stock
NASDAQ:TDS^V,TDS^V,Telephone and Data Systems Inc. Depositary Shares Each Representing a 1/1000th Interest in a 6.000% Series VV Cumulative Redeemable Perpetual Preferred Stock
NASDAQ:TDUP,TDUP,ThredUp Inc. Class A Common Stock
NASDAQ:TDW,TDW,Tidewater Inc. Common Stock
