NASDAQ:MCAF,MCAF,Mountain Crest Acquisition Corp. IV Common Stock
NASDAQ:MCAFR,MCAFR,Mountain Crest Acquisition Corp. IV Rights
NASDAQ:MCB,MCB,Metropolitan Bank Holding Corp. Common Stock
NASDAQ:MCBC,MCBC,Macatawa Bank Corporation Common Stock
NASDAQ:MCBS,MCBS,MetroCity Bankshares Inc. Common Stock
NASDAQ:MCD,MCD,McDonald's Corporation Common Stock
NASDAQ:MCF,MCF,Contango Oil & Gas Company Common Stock (TX)
NASDAQ:MCFE,MCFE,McAfee Corp. Class A Common Stock
NASDAQ:MCFT,MCFT,MasterCraft Boat Holdings Inc. Common Stock
NASDAQ:MCG,MCG,Membership Collective Group Inc. Class A Common Stock
NASDAQ:MCHP,MCHP,Microchip Technology Incorporated Common Stock
NASDAQ:MCHX,MCHX,Marchex Inc. Class B Common Stock
NASDAQ:MCI,MCI,Barings Corporate Investors Common Stock
NASDAQ:MCK,MCK,McKesson Corporation Common Stock
NASDAQ:MCMJ,MCMJ,Merida Merger Corp. I Common Stock
NASDAQ:MCMJW,MCMJW,Merida Merger Corp. I Warrant
NASDAQ:MCN,MCN,Madison Covered Call & Equity Strategy Fund Common Stock
NASDAQ:MCO,MCO,Moody's Corporation Common Stock
NASDAQ:MCR,MCR,MFS Charter Income Trust Common Stock
NASDAQ:MCRB,MCRB,Seres Therapeutics Inc. Common Stock
NASDAQ:MCRI,MCRI,Monarch Casino & Resort Inc. Common Stock
NASDAQ:MCS,MCS,Marcus Corporation (The) Common Stock
NASDAQ:MCW,MCW,Mister Car Wash Inc. Common Stock
NASDAQ:MCY,MCY,Mercury General Corporation Common Stock
NASDAQ:MD,MD,Mednax Inc. Common Stock
NASDAQ:MDB,MDB,MongoDB Inc. Class A Common Stock
NASDAQ:MDC,MDC,M.D.C. Holdings Inc. Common Stock
NASDAQ:MDGL,MDGL,Madrigal Pharmaceuticals Inc. Common Stock
NASDAQ:MDGS,MDGS,Medigus Ltd. American Depositary Shares
NASDAQ:MDGSW,MDGSW,Medigus Ltd. Series C Warrant
NASDAQ:MDH,MDH,MDH Acquisition Corp. Class A Common Stock
NASDAQ:MDIA,MDIA,Mediaco Holding Inc. Class A Common Stock
NASDAQ:MDJH,MDJH,MDJM LTD Ordinary Share
NASDAQ:MDLA,MDLA,Medallia Inc. Common Stock
NASDAQ:MDLZ,MDLZ,Mondelez International Inc. Class A Common Stock
NASDAQ:MDNA,MDNA,Medicenna Therapeutics Corp. Common Shares
NASDAQ:MDP,MDP,Meredith Corporation Common Stock
NASDAQ:MDRR,MDRR,Medalist Diversified REIT Inc. Common Stock
NASDAQ:MDRRP,MDRRP,Medalist Diversified REIT Inc. Series A Cumulative Redeemable Preferred Stock
NASDAQ:MDRX,MDRX,Allscripts Healthcare Solutions Inc. Common Stock
NASDAQ:MDT,MDT,Medtronic plc. Ordinary Shares
NASDAQ:MDU,MDU,MDU Resources Group Inc. Common Stock (Holding Company)
NASDAQ:MDVA,MDVA,Modiv Inc. 7.375% Series A Cumulative Redeemable Perpetual Preferred Stock
NASDAQ:MDVL,MDVL,MedAvail Holdings Inc. Common Stock
NASDAQ:MDWD,MDWD,MediWound Ltd. Ordinary Shares
NASDAQ:MDWT,MDWT,Midwest Holding Inc. Common Stock
NASDAQ:MDXG,MDXG,MiMedx Group Inc Common Stock
NASDAQ:ME,ME,23andMe Holding Co. Class A Common Stock
NASDAQ:MEAC,MEAC,Mercury Ecommerce Acquisition Corp Class A Common Stock
NASDAQ:MEACU,MEACU,Mercury Ecommerce Acquisition Corp Unit
NASDAQ:MEACW,MEACW,Mercury Ecommerce Acquisition Corp Warrants
NASDAQ:MEC,MEC,Mayville Engineering Company Inc. Common Stock
NASDAQ:MED,MED,MEDIFAST INC Common Stock
NASDAQ:MEDP,MEDP,Medpace Holdings Inc. Common Stock
NASDAQ:MEDS,MEDS,TRxADE HEALTH Inc. Common Stock
NASDAQ:MEG,MEG,Montrose Environmental Group Inc. Common Stock
NASDAQ:MEI,MEI,Methode Electronics Inc. Common Stock
NASDAQ:MEIP,MEIP,MEI Pharma Inc. Common Stock
NASDAQ:MEKA,MEKA,MELI Kaszek Pioneer Corp Class A Ordinary Shares
NASDAQ:MELI,MELI,MercadoLibre Inc. Common Stock
NASDAQ:MEOAU,MEOAU,Minority Equality Opportunities Acquisition Inc. Units
NASDAQ:MEOH,MEOH,Methanex Corporation Common Stock
NASDAQ:MER^K,MER^K,Bank of America Corporation Income Capital Obligation Notes initially due December 15 2066
NASDAQ:MERC,MERC,Mercer International Inc. Common Stock
NASDAQ:MESA,MESA,Mesa Air Group Inc. Common Stock
NASDAQ:MESO,MESO,Mesoblast Limited American Depositary Shares
NASDAQ:MET,MET,MetLife Inc. Common Stock
NASDAQ:MET^A,MET^A,MetLife Inc. Preferred Series A Floating Rate
NASDAQ:MET^E,MET^E,MetLife Inc. Depositary shares each representing a 1/1000th interest in a share of the Issuera??s 5.625% Non-Cumulative Preferred Stock Series E.
NASDAQ:MET^F,MET^F,MetLife Inc. Depositary Shares each representing a 1/1000th interest in a share of 4.75% Non-Cumulative Preferred Stock Series F
NASDAQ:METC,METC,Ramaco Resources Inc. Common Stock
NASDAQ:METCL,METCL,Ramaco Resources Inc. 9.00% Senior Notes due 2026
NASDAQ:METX,METX,Meten Holding Group Ltd. Ordinary Shares
NASDAQ:METXW,METXW,Meten Holding Group Ltd. Warrant
NASDAQ:MEUSW,MEUSW,23andMe Holding Co. Warrant
NASDAQ:MF,MF,Missfresh Limited American Depositary Shares
NASDAQ:MFA,MFA,MFA Financial Inc.
NASDAQ:MFA^B,MFA^B,MFA Financial Inc. Preferred Series B
NASDAQ:MFA^C,MFA^C,MFA Financial Inc. 6.50% Series C Fixed-to-Floating Rate Cumulative Redeemable Preferred Stock
NASDAQ:MFC,MFC,Manulife Financial Corporation Common Stock
NASDAQ:MFD,MFD,Macquarie First Trust Global Common Stock
NASDAQ:MFG,MFG,Mizuho Financial Group Inc. Sponosred ADR (Japan)
NASDAQ:MFGP,MFGP,Micro Focus Intl PLC ADS each representing One Ord Sh
NASDAQ:MFH,MFH,Mercurity Fintech Holding Inc. ADS
NASDAQ:MFIN,MFIN,Medallion Financial Corp. Common Stock
NASDAQ:MFL,MFL,Blackrock MuniHoldings Investment Quality Fund Common Shares of Beneficial Interest
NASDAQ:MFM,MFM,MFS Municipal Income Trust Common Stock
NASDAQ:MFV,MFV,MFS Special Value Trust Common Stock
NASDAQ:MG,MG,Mistras Group Inc Common Stock
NASDAQ:MGA,MGA,Magna International Inc. Common Stock
NASDAQ:MGEE,MGEE,MGE Energy Inc
NASDAQ:MGF,MGF,MFS Government Markets Income Trust Common Stock
NASDAQ:MGI,MGI,Moneygram International Inc. Common Stock
NASDAQ:MGIC,MGIC,Magic Software Enterprises Ltd. Ordinary Shares
NASDAQ:MGLN,MGLN,Magellan Health Inc. Common Stock
NASDAQ:MGM,MGM,MGM Resorts International Common Stock
NASDAQ:MGNI,MGNI,Magnite Inc. Common Stock
NASDAQ:MGNX,MGNX,MacroGenics Inc. Common Stock
NASDAQ:MGP,MGP,MGM Growth Properties LLC Class A common shares representing limited liability company interests
NASDAQ:MGPI,MGPI,MGP Ingredients Inc.
NASDAQ:MGR,MGR,Affiliated Managers Group Inc. 5.875% Junior Subordinated Notes due 2059
NASDAQ:MGRB,MGRB,Affiliated Managers Group Inc. 4.750% Junior Subordinated Notes due 2060
NASDAQ:MGRC,MGRC,McGrath RentCorp Common Stock
NASDAQ:MGRD,MGRD,Affiliated Managers Group Inc. 4.200% Junior Subordinated Notes due 2061
NASDAQ:MGTA,MGTA,Magenta Therapeutics Inc. Common Stock
NASDAQ:MGTX,MGTX,MeiraGTx Holdings plc Ordinary Shares
NASDAQ:MGU,MGU,Macquarie Global Infrastructure Total Return Fund Inc. Common Stock
NASDAQ:MGY,MGY,Magnolia Oil & Gas Corporation Class A Common Stock
NASDAQ:MGYR,MGYR,Magyar Bancorp Inc. Common Stock
NASDAQ:MH^A,MH^A,Maiden Holdings Ltd. Pref Shs Ser A (Bermuda)
NASDAQ:MH^C,MH^C,Maiden Holdings North America Ltd. 7.125% Non-Cumulative Preference Shares Series C
NASDAQ:MH^D,MH^D,Maiden Holdings Ltd. 6.700% Non-Cumulative Preference Shares Series D
NASDAQ:MHD,MHD,Blackrock MuniHoldings Fund Inc. Common Stock
NASDAQ:MHF,MHF,Western Asset Municipal High Income Fund Inc. Common Stock
NASDAQ:MHH,MHH,Mastech Digital Inc Common Stock
NASDAQ:MHI,MHI,Pioneer Municipal High Income Fund Inc.
NASDAQ:MHK,MHK,Mohawk Industries Inc. Common Stock
NASDAQ:MHLA,MHLA,Maiden Holdings Ltd. 6.625% Notes due 2046
NASDAQ:MHLD,MHLD,Maiden Holdings Ltd.
NASDAQ:MHN,MHN,Blackrock MuniHoldings New York Quality Fund Inc. Common Stock
NASDAQ:MHNC,MHNC,Maiden Holdings North America Ltd. 7.75% Notes due 2043
NASDAQ:MHO,MHO,M/I Homes Inc. Common Stock
NASDAQ:MIC,MIC,Macquarie Infrastructure Holdings LLC Common Unit
NASDAQ:MICT,MICT,MICT Inc. Common Stock
NASDAQ:MIDD,MIDD,Middleby Corporation (The) Common Stock
NASDAQ:MIGI,MIGI,Mawson Infrastructure Group Inc. Common Stock
NASDAQ:MILE,MILE,Metromile Inc. Common Stock
NASDAQ:MILEW,MILEW,Metromile Inc. Warrant
NASDAQ:MIME,MIME,Mimecast Limited Ordinary Shares
NASDAQ:MIMO,MIMO,Airspan Networks Holdings Inc. Common Stock
NASDAQ:MIN,MIN,MFS Intermediate Income Trust Common Stock
NASDAQ:MIND,MIND,MIND Technology Inc. Common Stock (DE)
NASDAQ:MINDP,MINDP,MIND Technology Inc. Series A 9.00% Series A Cumulative Preferred Stock (DE)
NASDAQ:MINM,MINM,Minim Inc. Common Stock
NASDAQ:MIO,MIO,Pioneer Municipal High Income Opportunities Fund Inc. Common Stock
NASDAQ:MIRM,MIRM,Mirum Pharmaceuticals Inc. Common Stock
NASDAQ:MIRO,MIRO,Miromatrix Medical Inc. Common Stock
NASDAQ:MIST,MIST,Milestone Pharmaceuticals Inc. Common Shares
NASDAQ:MIT,MIT,Mason Industrial Technology Inc. Class A Common Stock
NASDAQ:MITA,MITA,Coliseum Acquisition Corp. Class A Ordinary Share
NASDAQ:MITAU,MITAU,Coliseum Acquisition Corp. Unit
NASDAQ:MITC,MITC,MeaTech 3D Ltd. American Depositary Shares
NASDAQ:MITK,MITK,Mitek Systems Inc. Common Stock
NASDAQ:MITO,MITO,Stealth BioTherapeutics Corp. ADS
NASDAQ:MITQ,MITQ,Moving iMage Technologies Inc. Common Stock
NASDAQ:MITT,MITT,AG Mortgage Investment Trust Inc. Common Stock
NASDAQ:MITT^A,MITT^A,AG Mortgage Investment Trust Inc. 8.25% Preferred Series A
NASDAQ:MITT^B,MITT^B,AG Mortgage Investment Trust Inc. Preferred Series B
NASDAQ:MITT^C,MITT^C,AG Mortgage Investment Trust Inc. 8.00% Series C Fixed-to-Floating Rate Cumulative Redeemable Preferred Stock $0.01 par value per share
NASDAQ:MIXT,MIXT,MiX Telematics Limited American Depositary Shares each representing 25 Ordinary Shares
NASDAQ:MIY,MIY,Blackrock MuniYield Michigan Quality Fund Inc. Common Stock
NASDAQ:MKC,MKC,McCormick & Company Incorporated Common Stock
NASDAQ:MKD,MKD,Molecular Data Inc. American Depositary Shares
NASDAQ:MKFG,MKFG,Markforged Holding Corporation Common Stock
NASDAQ:MKL,MKL,Markel Corporation Common Stock
NASDAQ:MKSI,MKSI,MKS Instruments Inc. Common Stock
NASDAQ:MKTW,MKTW,MarketWise Inc. Class A Common Stock
NASDAQ:MKTWW,MKTWW,MarketWise Inc. Warrant
NASDAQ:MKTX,MKTX,MarketAxess Holdings Inc. Common Stock
NASDAQ:MKTY,MKTY,Mechanical Technology Incorporated Common Stock (Nevada)
NASDAQ:MKTYP,MKTYP,Mechanical Technology Incorporated 9.0% Series A Cumulative Perpetual Preferred Stock
NASDAQ:ML,ML,MoneyLion Inc. Class A Common Stock
NASDAQ:MLAB,MLAB,Mesa Laboratories Inc. Common Stock
NASDAQ:MLAC,MLAC,Malacca Straits Acquisition Company Limited Class A Ordinary Shares
NASDAQ:MLACU,MLACU,Malacca Straits Acquisition Company Limited Units
NASDAQ:MLACW,MLACW,Malacca Straits Acquisition Company Limited Warrants
NASDAQ:MLCO,MLCO,Melco Resorts & Entertainment Limited American Depositary Shares
NASDAQ:MLHR,MLHR,Herman Miller Inc. Common Stock
NASDAQ:MLI,MLI,Mueller Industries Inc. Common Stock
NASDAQ:MLM,MLM,Martin Marietta Materials Inc. Common Stock
NASDAQ:MLNK,MLNK,MeridianLink Inc. Common Stock
NASDAQ:MLP,MLP,Maui Land & Pineapple Company Inc. Common Stock
NASDAQ:MLR,MLR,Miller Industries Inc. Common Stock
NASDAQ:MLSS,MLSS,Milestone Scientific Inc. Common Stock
NASDAQ:MLVF,MLVF,Malvern Bancorp Inc. Common Stock
NASDAQ:MMAT,MMAT,Meta Materials Inc. Common Stock
NASDAQ:MMC,MMC,Marsh & McLennan Companies Inc. Common Stock
NASDAQ:MMD,MMD,MainStay MacKay DefinedTerm Municipal Opportunities Fund
NASDAQ:MMI,MMI,Marcus & Millichap Inc. Common Stock
NASDAQ:MMLP,MMLP,Martin Midstream Partners L.P. Limited Partnership
NASDAQ:MMM,MMM,3M Company Common Stock
NASDAQ:MMMB,MMMB,MamaMancini's Holdings Inc. Common Stock
NASDAQ:MMP,MMP,Magellan Midstream Partners L.P. Limited Partnership
NASDAQ:MMS,MMS,Maximus Inc. Common Stock
NASDAQ:MMSI,MMSI,Merit Medical Systems Inc. Common Stock
NASDAQ:MMT,MMT,MFS Multimarket Income Trust Common Stock
NASDAQ:MMU,MMU,Western Asset Managed Municipals Fund Inc. Common Stock
NASDAQ:MMX,MMX,Maverix Metals Inc. Common Shares
NASDAQ:MMYT,MMYT,MakeMyTrip Limited Ordinary Shares
NASDAQ:MN,MN,Manning & Napier Inc. Class A Common Stock
NASDAQ:MNDO,MNDO,MIND C.T.I. Ltd. Ordinary Shares
NASDAQ:MNDT,MNDT,Mandiant Inc. Common Stock
NASDAQ:MNDY,MNDY,monday.com Ltd. Ordinary Shares
NASDAQ:MNKD,MNKD,MannKind Corporation Common Stock
NASDAQ:MNMD,MNMD,Mind Medicine (MindMed) Inc. Subordinate Voting Shares
NASDAQ:MNOV,MNOV,Medicinova Inc Common Stock
NASDAQ:MNP,MNP,Western Asset Municipal Partners Fund Inc. Common Stock
NASDAQ:MNPR,MNPR,Monopar Therapeutics Inc. Common Stock
NASDAQ:MNR,MNR,Monmouth Real Estate Investment Corporation Class A Common Stock
NASDAQ:MNR^C,MNR^C,Monmouth Real Estate Investment Corporation 6.125% Series C Cumulative Redeemable Preferred Stock
NASDAQ:MNRL,MNRL,Brigham Minerals Inc. Class A Common Stock
NASDAQ:MNRO,MNRO,Monro Inc. Common Stock
NASDAQ:MNSB,MNSB,MainStreet Bancshares Inc. Common Stock
NASDAQ:MNSBP,MNSBP,MainStreet Bancshares Inc. Depositary Shares
NASDAQ:MNSO,MNSO,MINISO Group Holding Limited American Depositary Shares each representing four Class A Ordinary Shares
NASDAQ:MNST,MNST,Monster Beverage Corporation
NASDAQ:MNTK,MNTK,Montauk Renewables Inc. Common Stock
NASDAQ:MNTS,MNTS,Momentus Inc. Class A Common Stock
NASDAQ:MNTSW,MNTSW,Momentus Inc. Warrant
NASDAQ:MNTV,MNTV,Momentive Global Inc. Common Stock
NASDAQ:MNTX,MNTX,Manitex International Inc. Common Stock
NASDAQ:MO,MO,Altria Group Inc.
NASDAQ:MOD,MOD,Modine Manufacturing Company Common Stock
NASDAQ:MODN,MODN,Model N Inc. Common Stock
NASDAQ:MODV,MODV,ModivCare Inc. Common Stock
NASDAQ:MOFG,MOFG,MidWestOne Financial Gp Common Stock
NASDAQ:MOGO,MOGO,Mogo Inc. Common Shares
NASDAQ:MOGU,MOGU,MOGU Inc. American Depositary Shares (each representing 25 Class A Ordinary Shares)
NASDAQ:MOH,MOH,Molina Healthcare Inc Common Stock
NASDAQ:MOHO,MOHO,ECMOHO Limited American Depositary Shares
NASDAQ:MOLN,MOLN,Molecular Partners AG American Depositary Shares
NASDAQ:MOMO,MOMO,Hello Group Inc. American Depositary Shares
NASDAQ:MON,MON,Monument Circle Acquisition Corp. Class A Common Stock
NASDAQ:MONCU,MONCU,Monument Circle Acquisition Corp. Unit
NASDAQ:MONCW,MONCW,Monument Circle Acquisition Corp. Warrant
NASDAQ:MOR,MOR,MorphoSys AG American Depositary Shares
NASDAQ:MORF,MORF,Morphic Holding Inc. Common Stock
NASDAQ:MORN,MORN,Morningstar Inc. Common Stock
NASDAQ:MOS,MOS,Mosaic Company (The) Common Stock
NASDAQ:MOSY,MOSY,MoSys Inc. Common Stock
NASDAQ:MOTN,MOTN,Motion Acquisition Corp. Class A Common Stock
NASDAQ:MOTNU,MOTNU,Motion Acquisition Corp. Unit
NASDAQ:MOTNW,MOTNW,Motion Acquisition Corp. Warrants to purchase one Class A common
NASDAQ:MOTS,MOTS,Motus GI Holdings Inc. Common Stock
NASDAQ:MOTV,MOTV,Motive Capital Corp Class A Ordinary Shares
NASDAQ:MOV,MOV,Movado Group Inc. Common Stock
NASDAQ:MOVE,MOVE,Movano Inc. Common Stock
NASDAQ:MOXC,MOXC,Moxian (BVI) Inc Ordinary Shares
NASDAQ:MP,MP,MP Materials Corp. Common Stock
NASDAQ:MPA,MPA,Blackrock MuniYield Pennsylvania Quality Fund Common Stock
NASDAQ:MPAA,MPAA,Motorcar Parts of America Inc. Common Stock
NASDAQ:MPAC,MPAC,Model Performance Acquisition Corp. Class A Ordinary Share
NASDAQ:MPACR,MPACR,Model Performance Acquisition Corp. Right
NASDAQ:MPACW,MPACW,Model Performance Acquisition Corp. Warrant
NASDAQ:MPB,MPB,Mid Penn Bancorp Common Stock
NASDAQ:MPC,MPC,Marathon Petroleum Corporation Common Stock
NASDAQ:MPLN,MPLN,MultiPlan Corporation Class A Common Stock
NASDAQ:MPLX,MPLX,MPLX LP Common Units Representing Limited Partner Interests
NASDAQ:MPV,MPV,Barings Participation Investors Common Stock
NASDAQ:MPW,MPW,Medical Properties Trust Inc. common stock
NASDAQ:MPWR,MPWR,Monolithic Power Systems Inc. Common Stock
NASDAQ:MPX,MPX,Marine Products Corporation Common Stock
NASDAQ:MQ,MQ,Marqeta Inc. Class A Common Stock
NASDAQ:MQT,MQT,Blackrock MuniYield Quality Fund II Inc. Common Stock
NASDAQ:MQY,MQY,Blackrock MuniYield Quality Fund Inc. Common Stock
NASDAQ:MRAM,MRAM,Everspin Technologies Inc. Common Stock
NASDAQ:MRBK,MRBK,Meridian Corporation Common Stock
NASDAQ:MRC,MRC,MRC Global Inc. Common Stock
NASDAQ:MRCC,MRCC,Monroe Capital Corporation Common Stock
NASDAQ:MRCY,MRCY,Mercury Systems Inc Common Stock
NASDAQ:MREO,MREO,Mereo BioPharma Group plc American Depositary Shares
NASDAQ:MRIN,MRIN,Marin Software Incorporated Common Stock
NASDAQ:MRK,MRK,Merck & Company Inc. Common Stock (new)
NASDAQ:MRKR,MRKR,Marker Therapeutics Inc. Common Stock
NASDAQ:MRLN,MRLN,Marlin Business Services Corp. Common Stock
NASDAQ:MRM,MRM,MEDIROM Healthcare Technologies Inc. American Depositary Share
NASDAQ:MRNA,MRNA,Moderna Inc. Common Stock
NASDAQ:MRNS,MRNS,Marinus Pharmaceuticals Inc. Common Stock
NASDAQ:MRO,MRO,Marathon Oil Corporation Common Stock
NASDAQ:MRSN,MRSN,Mersana Therapeutics Inc. Common Stock
NASDAQ:MRTN,MRTN,Marten Transport Ltd. Common Stock
NASDAQ:MRTX,MRTX,Mirati Therapeutics Inc. Common Stock
NASDAQ:MRUS,MRUS,Merus N.V. Common Shares
NASDAQ:MRVI,MRVI,Maravai LifeSciences Holdings Inc. Class A Common Stock
NASDAQ:MRVL,MRVL,Marvell Technology Inc. Common Stock
NASDAQ:MS,MS,Morgan Stanley Common Stock
NASDAQ:MS^A,MS^A,Morgan Stanley Dep Shs repstg 1/1000 Pfd Ser A
NASDAQ:MS^E,MS^E,Morgan Stanley DEPOSITARY SHARES REP 1/1000TH SHARES FIXED/FLTG PREFERRED STOCK SERIES E
NASDAQ:MS^F,MS^F,Morgan Stanley Dep Shs Rpstg 1/1000th Int Prd Ser F Fxd to Flag
NASDAQ:MS^I,MS^I,Morgan Stanley Depository Shares Representing 1/1000th Preferred Series 1 Fixed to Floating Non (Cum)
NASDAQ:MS^K,MS^K,Morgan Stanley Depositary Shares each representing 1/1000th of a share of Fixed-to-Floating Rate Non-Cumulative Preferred Stock Series K
NASDAQ:MS^L,MS^L,Morgan Stanley Depositary Shares each representing 1/1000th of a share of 4.875% Non-Cumulative Preferred Stock Series L
NASDAQ:MSA,MSA,MSA Safety Incorporated Common Stock
NASDAQ:MSAC,MSAC,Medicus Sciences Acquisition Corp. Class A Ordinary Share
NASDAQ:MSACW,MSACW,Medicus Sciences Acquisition Corp. Warrant
NASDAQ:MSB,MSB,Mesabi Trust Common Stock
NASDAQ:MSBI,MSBI,Midland States Bancorp Inc. Common Stock
NASDAQ:MSC,MSC,Studio City International Holdings Limited American depositary shares each representing four Class A ordinary shares
NASDAQ:MSCI,MSCI,MSCI Inc Common Stock
NASDAQ:MSD,MSD,Morgan Stanley Emerging Markets Debt Fund Inc. Common Stock
NASDAQ:MSDA,MSDA,MSD Acquisition Corp. Class A Ordinary Shares
NASDAQ:MSDAU,MSDAU,MSD Acquisition Corp. Unit
NASDAQ:MSDAW,MSDAW,MSD Acquisition Corp. Warrant
NASDAQ:MSEX,MSEX,Middlesex Water Company Common Stock
NASDAQ:MSFT,MSFT,Microsoft Corporation Common Stock
NASDAQ:MSGE,MSGE,Madison Square Garden Entertainment Corp. Class A Common Stock
NASDAQ:MSGM,MSGM,Motorsport Games Inc. Class A Common Stock
NASDAQ:MSGS,MSGS,Madison Square Garden Sports Corp. Class A Common Stock (New)
NASDAQ:MSI,MSI,Motorola Solutions Inc. Common Stock
NASDAQ:MSM,MSM,MSC Industrial Direct Company Inc. Common Stock
NASDAQ:MSN,MSN,Emerson Radio Corporation Common Stock
NASDAQ:MSON,MSON,MISONIX Inc. Common Stock (DE)
NASDAQ:MSP,MSP,Datto Holding Corp. Common Stock
NASDAQ:MSTR,MSTR,MicroStrategy Incorporated Common Stock Class A
NASDAQ:MSVB,MSVB,Mid-Southern Bancorp Inc. Common Stock
NASDAQ:MT,MT,Arcelor Mittal NY Registry Shares NEW
NASDAQ:MTA,MTA,Metalla Royalty & Streaming Ltd. Common Shares
NASDAQ:MTAC,MTAC,MedTech Acquisition Corporation Class A Common Stock
NASDAQ:MTACU,MTACU,MedTech Acquisition Corporation Unit
NASDAQ:MTACW,MTACW,MedTech Acquisition Corporation Warrant
NASDAQ:MTAL,MTAL,Metals Acquisition Corp Class A Ordinary Shares
NASDAQ:MTB,MTB,M&T Bank Corporation Common Stock
NASDAQ:MTBC,MTBC,CareCloud Inc. Common Stock
NASDAQ:MTBCP,MTBCP,CareCloud Inc. 11% Series A Cumulative Redeemable Perpetual Preferred Stock
NASDAQ:MTC,MTC,MMTec Inc. Common Shares
NASDAQ:MTCH,MTCH,Match Group Inc. Common Stock
NASDAQ:MTCN,MTCN,ArcelorMittal 5.50% Mandatorily Convertible Subordinated Notes due 2023
NASDAQ:MTCR,MTCR,Metacrine Inc. Common Stock
NASDAQ:MTD,MTD,Mettler-Toledo International Inc. Common Stock
NASDAQ:MTDR,MTDR,Matador Resources Company Common Stock
NASDAQ:MTEM,MTEM,Molecular Templates Inc. Common Stock
NASDAQ:MTEX,MTEX,Mannatech Incorporated Common Stock
NASDAQ:MTG,MTG,MGIC Investment Corporation Common Stock
NASDAQ:MTH,MTH,Meritage Homes Corporation Common Stock
NASDAQ:MTL,MTL,Mechel PAO American Depositary Shares (Each rep. 1 common shares)
NASDAQ:MTL^,MTL^,Mechel PAO American Depositary Shares (each representing one-half of a Preferred Share)
NASDAQ:MTLS,MTLS,Materialise NV American Depositary Shares
NASDAQ:MTN,MTN,Vail Resorts Inc. Common Stock
NASDAQ:MTNB,MTNB,Matinas Biopharma Holdings Inc. Common Stock
NASDAQ:MTOR,MTOR,Meritor Inc. Common Stock
NASDAQ:MTP,MTP,Midatech Pharma PLC American Depositary Shs
NASDAQ:MTR,MTR,Mesa Royalty Trust Common Stock
NASDAQ:MTRN,MTRN,Materion Corporation
NASDAQ:MTRX,MTRX,Matrix Service Company Common Stock
NASDAQ:MTRYU,MTRYU,Monterey Bio Acquisition Corporation Unit
NASDAQ:MTSI,MTSI,MACOM Technology Solutions Holdings Inc. Common Stock
NASDAQ:MTTR,MTTR,Matterport Inc. Class A Common Stock
NASDAQ:MTTRW,MTTRW,Matterport Inc. Warrant
NASDAQ:MTW,MTW,Manitowoc Company Inc. (The) Common Stock
NASDAQ:MTX,MTX,Minerals Technologies Inc. Common Stock
NASDAQ:MTZ,MTZ,MasTec Inc. Common Stock
NASDAQ:MU,MU,Micron Technology Inc. Common Stock
NASDAQ:MUA,MUA,Blackrock MuniAssets Fund Inc Common Stock
NASDAQ:MUC,MUC,Blackrock MuniHoldings California Quality Fund Inc. Common Stock
NASDAQ:MUDS,MUDS,Mudrick Capital Acquisition Corporation II Class A Common Stock
NASDAQ:MUDSU,MUDSU,Mudrick Capital Acquisition Corporation II Unit
NASDAQ:MUDSW,MUDSW,Mudrick Capital Acquisition Corporation II Warrant
NASDAQ:MUE,MUE,Blackrock MuniHoldings Quality Fund II Inc. Common Stock
NASDAQ:MUFG,MUFG,Mitsubishi UFJ Financial Group Inc. Common Stock
NASDAQ:MUI,MUI,BlackRock Municipal Income Fund Inc. Common Stock
NASDAQ:MUJ,MUJ,Blackrock MuniHoldings New Jersey Quality Fund Inc. Common Stock
NASDAQ:MUR,MUR,Murphy Oil Corporation Common Stock
NASDAQ:MUSA,MUSA,Murphy USA Inc. Common Stock
NASDAQ:MUX,MUX,McEwen Mining Inc. Common Stock
NASDAQ:MVBF,MVBF,MVB Financial Corp. Common Stock
NASDAQ:MVF,MVF,Blackrock MuniVest Fund Inc. Common Stock
NASDAQ:MVIS,MVIS,MicroVision Inc. Common Stock
NASDAQ:MVO,MVO,MV Oil Trust Units of Beneficial Interests
NASDAQ:MVST,MVST,Microvast Holdings Inc. Common Stock
NASDAQ:MVSTW,MVSTW,Microvast Holdings Inc. Warrants
NASDAQ:MVT,MVT,Blackrock MuniVest Fund II Inc. Common Stock
NASDAQ:MWA,MWA,MUELLER WATER PRODUCTS Common Stock
NASDAQ:MX,MX,Magnachip Semiconductor Corporation Common Stock
NASDAQ:MXC,MXC,Mexco Energy Corporation Common Stock
NASDAQ:MXCT,MXCT,MaxCyte Inc. Common Stock
NASDAQ:MXE,MXE,Mexico Equity and Income Fund Inc. (The) Common Stock
NASDAQ:MXF,MXF,Mexico Fund Inc. (The) Common Stock
NASDAQ:MXL,MXL,MaxLinear Inc. Common Stock
NASDAQ:MYC,MYC,Blackrock MuniYield California Fund Inc. Common Stock
NASDAQ:MYD,MYD,Blackrock MuniYield Fund Inc. Common Stock
NASDAQ:MYE,MYE,Myers Industries Inc. Common Stock
NASDAQ:MYFW,MYFW,First Western Financial Inc. Common Stock
NASDAQ:MYGN,MYGN,Myriad Genetics Inc. Common Stock
NASDAQ:MYI,MYI,Blackrock MuniYield Quality Fund III Inc Common Stock
NASDAQ:MYJ,MYJ,Blackrock MuniYield New Jersey Fund Inc Common Stock
NASDAQ:MYMD,MYMD,MyMD Pharmaceuticals Inc. Common Stock
NASDAQ:MYN,MYN,Blackrock MuniYield New York Quality Fund Inc.Common Stock
NASDAQ:MYO,MYO,Myomo Inc. Common Stock
NASDAQ:MYOV,MYOV,Myovant Sciences Ltd. Common Shares
NASDAQ:MYPS,MYPS,PLAYSTUDIOS Inc. Class A Common Stock
NASDAQ:MYPSW,MYPSW,PLAYSTUDIOS Inc. Warrant
NASDAQ:MYRG,MYRG,MYR Group Inc. Common Stock
NASDAQ:MYSZ,MYSZ,My Size Inc. Common Stock
NASDAQ:MYTE,MYTE,MYT Netherlands Parent B.V. American Depositary Shares each representing one Ordinary Share
NASDAQ:NAAC,NAAC,North Atlantic Acquisition Corporation Class A Ordinary Share
NASDAQ:NABL,NABL,N-able Inc. Common Stock
NASDAQ:NAC,NAC,Nuveen California Quality Municipal Income Fund
NASDAQ:NAD,NAD,Nuveen Quality Municipal Income Fund Common Stock
NASDAQ:NAII,NAII,Natural Alternatives International Inc. Common Stock
NASDAQ:NAK,NAK,Northern Dynasty Minerals Ltd. Common Stock
NASDAQ:NAKD,NAKD,Naked Brand Group Limited Ordinary Shares
NASDAQ:NAN,NAN,Nuveen New York Quality Municipal Income Fund Common Stock
NASDAQ:NAOV,NAOV,NanoVibronix Inc. Common Stock
NASDAQ:NAPA,NAPA,The Duckhorn Portfolio Inc. Common Stock
NASDAQ:NARI,NARI,Inari Medical Inc. Common Stock
NASDAQ:NAT,NAT,Nordic American Tankers Limited Common Stock
NASDAQ:NATH,NATH,Nathan's Famous Inc. Common Stock
NASDAQ:NATI,NATI,National Instruments Corporation Common Stock
NASDAQ:NATR,NATR,Nature's Sunshine Products Inc. Common Stock
NASDAQ:NAUT,NAUT,Nautilus Biotechnolgy Inc. Common Stock
NASDAQ:NAVB,NAVB,Navidea Biopharmaceuticals Inc. Common Stock
NASDAQ:NAVI,NAVI,Navient Corporation Common Stock
NASDAQ:NAZ,NAZ,Nuveen Arizona Quality Municipal Income Fund Common Stock
NASDAQ:NBB,NBB,Nuveen Taxable Municipal Income Fund Common Shares of Beneficial Interest
NASDAQ:NBEV,NBEV,NewAge Inc. Common Stock (Delaware)
NASDAQ:NBH,NBH,Neuberger Berman Municipal Fund Inc. Common Stock
NASDAQ:NBHC,NBHC,National Bank Holdings Corporation Common Stock
NASDAQ:NBIX,NBIX,Neurocrine Biosciences Inc. Common Stock
NASDAQ:NBN,NBN,Northeast Bank Common Stock
NASDAQ:NBO,NBO,Neuberger Berman New York Municipal Fund Inc. Common Stock
NASDAQ:NBR,NBR,Nabors Industries Ltd.
NASDAQ:NBRV,NBRV,Nabriva Therapeutics plc Ordinary Shares Ireland
NASDAQ:NBSE,NBSE,NeuBase Therapeutics Inc. Common Stock
NASDAQ:NBST,NBST,Newbury Street Acquisition Corporation Common Stock
NASDAQ:NBSTW,NBSTW,Newbury Street Acquisition Corporation Warrants
NASDAQ:NBTB,NBTB,NBT Bancorp Inc. Common Stock
NASDAQ:NBTX,NBTX,Nanobiotix S.A. American Depositary Shares
NASDAQ:NBW,NBW,Neuberger Berman California Municipal Fund Inc Common Stock
NASDAQ:NBXG,NBXG,Neuberger Berman Next Generation Connectivity Fund Inc. Common Stock
NASDAQ:NBY,NBY,NovaBay Pharmaceuticals Inc. Common Stock
NASDAQ:NC,NC,NACCO Industries Inc. Common Stock
